Title,URL
A Long Obedience in the Same Direction: Discipleship in an Instant Society,https://www.goodreads.com/book/show/579014.A_Long_Obedience_in_the_Same_Direction
A Year of Biblical Womanhood,https://www.goodreads.com/book/show/13544022-a-year-of-biblical-womanhood
Crazy Busy: A (Mercifully) Short Book about a (Really) Big Problem,https://www.goodreads.com/book/show/17152690-crazy-busy
"Gods and Kings (Chronicles of the Kings, #1)",https://www.goodreads.com/book/show/359994.Gods_and_Kings
"Twelve Extraordinary Women: How God Shaped Women of the Bible, and What He Wants to Do with You",https://www.goodreads.com/book/show/29023.Twelve_Extraordinary_Women
The Passion of Jesus Christ,https://www.goodreads.com/book/show/45362.The_Passion_of_Jesus_Christ
Peace Child: An Unforgettable Story of Primitive Jungle Teaching in the 20th Century,https://www.goodreads.com/book/show/298816.Peace_Child
Walking with God through Pain and Suffering,https://www.goodreads.com/book/show/17674979-walking-with-god-through-pain-and-suffering
Let Me Be a Woman,https://www.goodreads.com/book/show/56396.Let_Me_Be_a_Woman
God in the Dock: Essays on Theology and Ethics,https://www.goodreads.com/book/show/111563.God_in_the_Dock
The Life You've Always Wanted: Spiritual Disciplines for Ordinary People,https://www.goodreads.com/book/show/161419.The_Life_You_ve_Always_Wanted
7: An Experimental Mutiny Against Excess,https://www.goodreads.com/book/show/12171769-7
The Discipline of Grace: God's Role and Our Role in the Pursuit of Holiness,https://www.goodreads.com/book/show/246849.The_Discipline_of_Grace
City of God,https://www.goodreads.com/book/show/25673.City_of_God
Twelve Ordinary Men,https://www.goodreads.com/book/show/29031.Twelve_Ordinary_Men
The Hole in Our Gospel: What Does God Expect of Us? the Answer That Changed My Life and Might Just Change the World,https://www.goodreads.com/book/show/5291189-the-hole-in-our-gospel
The Princess,https://www.goodreads.com/book/show/289747.The_Princess
"A Light in the Window (Mitford Years, #2)",https://www.goodreads.com/book/show/112872.A_Light_in_the_Window
Cold-Case Christianity: A Homicide Detective Investigates the Claims of the Gospels,https://www.goodreads.com/book/show/13593814-cold-case-christianity
Bridge to Haven,https://www.goodreads.com/book/show/18228202-bridge-to-haven
"Remember (Redemption, #2)",https://www.goodreads.com/book/show/35332.Remember
Prophet,https://www.goodreads.com/book/show/8492.Prophet
In the Grip of Grace: You Can't Fall Beyond His Love,https://www.goodreads.com/book/show/281520.In_the_Grip_of_Grace
Bad Girls of the Bible: And What We Can Learn from Them,https://www.goodreads.com/book/show/47941.Bad_Girls_of_the_Bible
Multiply: Disciples Making Disciples,https://www.goodreads.com/book/show/13228935-multiply
You Are What You Love: The Spiritual Power of Habit,https://www.goodreads.com/book/show/26568656-you-are-what-you-love
Evangelism & the Sovereignty of God,https://www.goodreads.com/book/show/123074.Evangelism_the_Sovereignty_of_God
Joni: An Unforgettable Story,https://www.goodreads.com/book/show/124524.Joni
Jesus Feminist: An Invitation to Revisit the Bible's View of Women,https://www.goodreads.com/book/show/17570843-jesus-feminist
"Bruchko: The Astonishing True Story of a 19-Year-Old American, His Capture by the Motilone Indians and His Adventures in Christianizing the Stone Age Tribe",https://www.goodreads.com/book/show/296696.Bruchko
Traveling Mercies: Some Thoughts on Faith,https://www.goodreads.com/book/show/10890.Traveling_Mercies
Shadow of the Almighty: The Life and Testament of Jim Elliot,https://www.goodreads.com/book/show/9551.Shadow_of_the_Almighty
Paradise Lost,https://www.goodreads.com/book/show/15997.Paradise_Lost
"The Story: The Bible as One Continuing Story of God and His People, NIV",https://www.goodreads.com/book/show/10860921-the-story
New Morning Mercies: A Daily Gospel Devotional,https://www.goodreads.com/book/show/19353106-new-morning-mercies
"When People Are Big and God is Small: Overcoming Peer Pressure, Codependency, and the Fear of Man (Resources for Changing Lives)",https://www.goodreads.com/book/show/34485.When_People_Are_Big_and_God_is_Small
Fireproof,https://www.goodreads.com/book/show/3412815-fireproof
Instruments in the Redeemer's Hands: People in Need of Change Helping People in Need of Change (Resources for Changing Lives),https://www.goodreads.com/book/show/211169.Instruments_in_the_Redeemer_s_Hands
Confronting Christianity: 12 Hard Questions for the World's Largest Religion,https://www.goodreads.com/book/show/42248511-confronting-christianity
"The Fairest Beauty (Hagenheim, #3)",https://www.goodreads.com/book/show/15700446-the-fairest-beauty
Letters to Malcolm: Chiefly on Prayer,https://www.goodreads.com/book/show/31068.Letters_to_Malcolm
The Language of God: A Scientist Presents Evidence for Belief,https://www.goodreads.com/book/show/35506.The_Language_of_God
A Tailor-Made Bride,https://www.goodreads.com/book/show/6973772-a-tailor-made-bride
"The Shunning (The Heritage of Lancaster County, #1)",https://www.goodreads.com/book/show/508413.The_Shunning
The Jesus Storybook Bible: Every Story Whispers His Name,https://www.goodreads.com/book/show/165068.The_Jesus_Storybook_Bible
"Return (Redemption, #3)",https://www.goodreads.com/book/show/11430.Return
Safely Home,https://www.goodreads.com/book/show/290369.Safely_Home
I Dared to Call Him Father: The Miraculous Story of a Muslim Woman's Encounter with God,https://www.goodreads.com/book/show/98696.I_Dared_to_Call_Him_Father
Misreading Scripture with Western Eyes: Removing Cultural Blinders to Better Understand the Bible,https://www.goodreads.com/book/show/13799973-misreading-scripture-with-western-eyes
"A Wrinkle in Time (Time Quintet, #1)",https://www.goodreads.com/book/show/33574273-a-wrinkle-in-time
Life of the Beloved: Spiritual Living in a Secular World,https://www.goodreads.com/book/show/6151.Life_of_the_Beloved
Breaking Free: Discover the Victory of Total Surrender,https://www.goodreads.com/book/show/441618.Breaking_Free
"Unspoken: Bathsheba (Lineage of Grace, #4)",https://www.goodreads.com/book/show/535179.Unspoken
"Rejoice (Redemption, #4)",https://www.goodreads.com/book/show/11436.Rejoice
And the Shofar Blew,https://www.goodreads.com/book/show/95619.And_the_Shofar_Blew
The Power of a Praying Woman,https://www.goodreads.com/book/show/18054709-the-power-of-a-praying-woman
Mortification of Sin,https://www.goodreads.com/book/show/310016.Mortification_of_Sin
Holy Bible: New Living Translation,https://www.goodreads.com/book/show/930470.Holy_Bible
"Love's Long Journey (Love Comes Softly, #3)",https://www.goodreads.com/book/show/65484.Love_s_Long_Journey
The Normal Christian Life,https://www.goodreads.com/book/show/1027982.The_Normal_Christian_Life
"One Tuesday Morning (9/11, #1)",https://www.goodreads.com/book/show/97862.One_Tuesday_Morning
When God Whispers Your Name,https://www.goodreads.com/book/show/173325.When_God_Whispers_Your_Name
