Title,URL
"Wolfsong (Green Creek, #1)",https://www.goodreads.com/book/show/29233804-wolfsong
"Narcissus in Chains (Anita Blake, Vampire Hunter, #10)",https://www.goodreads.com/book/show/30248.Narcissus_in_Chains
"Touch the Dark (Cassandra Palmer, #1)",https://www.goodreads.com/book/show/67513.Touch_the_Dark
"Father Mine (Black Dagger Brotherhood, #6.5)",https://www.goodreads.com/book/show/5153799-father-mine
"Harry Potter and the Deathly Hallows (Harry Potter, #7)",https://www.goodreads.com/book/show/136251.Harry_Potter_and_the_Deathly_Hallows
"Harry Potter and the Prisoner of Azkaban (Harry Potter, #3)",https://www.goodreads.com/book/show/5.Harry_Potter_and_the_Prisoner_of_Azkaban
"The Retribution of Mara Dyer (Mara Dyer, #3)",https://www.goodreads.com/book/show/15768409-the-retribution-of-mara-dyer
"Throne of Glass (Throne of Glass, #1)",https://www.goodreads.com/book/show/76703559-throne-of-glass
"How to Marry a Millionaire Vampire (Love at Stake, #1)",https://www.goodreads.com/book/show/263179.How_to_Marry_a_Millionaire_Vampire
"Evernight (Evernight, #1)",https://www.goodreads.com/book/show/2722413-evernight
"Up from the Grave (Night Huntress, #7)",https://www.goodreads.com/book/show/10357792-up-from-the-grave
"Iced (Fever, #6)",https://www.goodreads.com/book/show/12444166-iced
"The Darkest Whisper (Lords of the Underworld, #4)",https://www.goodreads.com/book/show/5509920-the-darkest-whisper
"Blue Moon (The Immortals, #2)",https://www.goodreads.com/book/show/6134826-blue-moon
"Blaze of Memory (Psy-Changeling, #7)",https://www.goodreads.com/book/show/6353014-blaze-of-memory
"Harry Potter and the Goblet of Fire (Harry Potter, #4)",https://www.goodreads.com/book/show/6.Harry_Potter_and_the_Goblet_of_Fire
"Switched (Trylle, #1)",https://www.goodreads.com/book/show/12180581-switched
"Heartless (Parasol Protectorate, #4)",https://www.goodreads.com/book/show/8356487-heartless
"Play of Passion (Psy-Changeling, #9)",https://www.goodreads.com/book/show/7831145-play-of-passion
"Harry Potter and the Order of the Phoenix (Harry Potter, #5)",https://www.goodreads.com/book/show/2.Harry_Potter_and_the_Order_of_the_Phoenix
"Significance (Significance, #1)",https://www.goodreads.com/book/show/35534230-significance
"Unspoken (The Lynburn Legacy, #1)",https://www.goodreads.com/book/show/10866624-unspoken
The Southern Book Club's Guide to Slaying Vampires,https://www.goodreads.com/book/show/44074800-the-southern-book-club-s-guide-to-slaying-vampires
"White Hot (Hidden Legacy, #2)",https://www.goodreads.com/book/show/22303684-white-hot
"Passion Unleashed (Demonica, #3)",https://www.goodreads.com/book/show/4701550-passion-unleashed
"The Queen of the Damned (The Vampire Chronicles, #3)",https://www.goodreads.com/book/show/43758.The_Queen_of_the_Damned
"Sixth Grave on the Edge (Charley Davidson, #6)",https://www.goodreads.com/book/show/16061295-sixth-grave-on-the-edge
"Sins of the Night (Dark-Hunter, #7)",https://www.goodreads.com/book/show/84135.Sins_of_the_Night
"Stray (Shifters, #1)",https://www.goodreads.com/book/show/793399.Stray
"Beyond the Highland Mist (Highlander, #1)",https://www.goodreads.com/book/show/743599.Beyond_the_Highland_Mist
"Lair of Dreams (The Diviners, #2)",https://www.goodreads.com/book/show/16060716-lair-of-dreams
"Dark Side of the Moon (Dark-Hunter, #9; Were-Hunter, #3)",https://www.goodreads.com/book/show/84146.Dark_Side_of_the_Moon
"Dead Heat (Alpha & Omega, #4)",https://www.goodreads.com/book/show/22571699-dead-heat
"Harry Potter and the Half-Blood Prince (Harry Potter, #6)",https://www.goodreads.com/book/show/1.Harry_Potter_and_the_Half_Blood_Prince
"Shadow and Bone (The Shadow and Bone Trilogy, #1)",https://www.goodreads.com/book/show/10194157-shadow-and-bone
"Wicked Cravings (The Phoenix Pack, #2)",https://www.goodreads.com/book/show/16141092-wicked-cravings
"Silence Fallen (Mercy Thompson, #10)",https://www.goodreads.com/book/show/30687916-silence-fallen
