Title,URL
"Twilight (The Twilight Saga, #1)",https://www.goodreads.com/book/show/41865.Twilight
"City of Bones (The Mortal Instruments, #1)",https://www.goodreads.com/book/show/256683.City_of_Bones
"New Moon (The Twilight Saga, #2)",https://www.goodreads.com/book/show/49041.New_Moon
"Breaking Dawn (The Twilight Saga, #4)",https://www.goodreads.com/book/show/1162543.Breaking_Dawn
"Dark Lover (Black Dagger Brotherhood, #1)",https://www.goodreads.com/book/show/42899.Dark_Lover
"Vampire Academy (Vampire Academy, #1)",https://www.goodreads.com/book/show/345627.Vampire_Academy
"City of Ashes (The Mortal Instruments, #2)",https://www.goodreads.com/book/show/1582996.City_of_Ashes
"Dead Until Dark (Sookie Stackhouse, #1)",https://www.goodreads.com/book/show/301082.Dead_Until_Dark
"City of Glass (The Mortal Instruments, #3)",https://www.goodreads.com/book/show/3777732-city-of-glass
"The Raven Boys (The Raven Cycle, #1)",https://www.goodreads.com/book/show/17675462-the-raven-boys
"Hush, Hush (Hush, Hush, #1)",https://www.goodreads.com/book/show/6339664-hush-hush
"Halfway to the Grave (Night Huntress, #1)",https://www.goodreads.com/book/show/1421990.Halfway_to_the_Grave
"Darkfever (Fever, #1)",https://www.goodreads.com/book/show/112750.Darkfever
"Moon Called (Mercy Thompson, #1)",https://www.goodreads.com/book/show/71811.Moon_Called
"Clockwork Angel (The Infernal Devices, #1)",https://www.goodreads.com/book/show/7171637-clockwork-angel
"A Discovery of Witches (All Souls, #1)",https://www.goodreads.com/book/show/8667848-a-discovery-of-witches
"Obsidian (Lux, #1)",https://www.goodreads.com/book/show/12578077-obsidian
"Shiver (The Wolves of Mercy Falls, #1)",https://www.goodreads.com/book/show/6068551-shiver
"Lover Eternal (Black Dagger Brotherhood, #2)",https://www.goodreads.com/book/show/35729.Lover_Eternal
"Lover Awakened (Black Dagger Brotherhood, #3)",https://www.goodreads.com/book/show/42900.Lover_Awakened
"Miss Peregrine's Home for Peculiar Children (Miss Peregrine's Peculiar Children, #1)",https://www.goodreads.com/book/show/9460487-miss-peregrine-s-home-for-peculiar-children
"Beautiful Creatures (Caster Chronicles, #1)",https://www.goodreads.com/book/show/6304335-beautiful-creatures
"Frostbite (Vampire Academy, #2)",https://www.goodreads.com/book/show/2282133.Frostbite
"City of Fallen Angels (The Mortal Instruments, #4)",https://www.goodreads.com/book/show/6752378-city-of-fallen-angels
"Daughter of Smoke & Bone (Daughter of Smoke & Bone, #1)",https://www.goodreads.com/book/show/8490112-daughter-of-smoke-bone
"Fallen (Fallen, #1)",https://www.goodreads.com/book/show/6487308-fallen
"Shadow Kiss (Vampire Academy, #3)",https://www.goodreads.com/book/show/2802316-shadow-kiss
"Magic Bites (Kate Daniels, #1)",https://www.goodreads.com/book/show/38619.Magic_Bites
"Living Dead in Dallas (Sookie Stackhouse, #2)",https://www.goodreads.com/book/show/110494.Living_Dead_in_Dallas
"Blood Promise (Vampire Academy, #4)",https://www.goodreads.com/book/show/5996153-blood-promise
"Club Dead (Sookie Stackhouse, #3)",https://www.goodreads.com/book/show/140082.Club_Dead
"Marked (House of Night, #1)",https://www.goodreads.com/book/show/30183.Marked
"Lover Revealed (Black Dagger Brotherhood, #4)",https://www.goodreads.com/book/show/42898.Lover_Revealed
"City of Lost Souls (The Mortal Instruments, #5)",https://www.goodreads.com/book/show/8755776-city-of-lost-souls
"Angelfall (Penryn & the End of Days, #1)",https://www.goodreads.com/book/show/15863832-angelfall
"Lover Unbound (Black Dagger Brotherhood, #5)",https://www.goodreads.com/book/show/304027.Lover_Unbound
"Spirit Bound (Vampire Academy, #5)",https://www.goodreads.com/book/show/6479259-spirit-bound
"Dead to the World (Sookie Stackhouse, #4)",https://www.goodreads.com/book/show/140077.Dead_to_the_World
"Last Sacrifice (Vampire Academy, #6)",https://www.goodreads.com/book/show/6527740-last-sacrifice
"First Grave on the Right (Charley Davidson, #1)",https://www.goodreads.com/book/show/8788554-first-grave-on-the-right
"A Hunger Like No Other (Immortals After Dark, #1)",https://www.goodreads.com/book/show/14384.A_Hunger_Like_No_Other
"Soulless (Parasol Protectorate, #1)",https://www.goodreads.com/book/show/6381205-soulless
"The Unbecoming of Mara Dyer (Mara Dyer, #1)",https://www.goodreads.com/book/show/11408650-the-unbecoming-of-mara-dyer
"Clockwork Prince (The Infernal Devices, #2)",https://www.goodreads.com/book/show/10025305-clockwork-prince
"Dead as a Doornail (Sookie Stackhouse, #5)",https://www.goodreads.com/book/show/170210.Dead_as_a_Doornail
"Slave to Sensation (Psy-Changeling, #1)",https://www.goodreads.com/book/show/178476.Slave_to_Sensation
"Angels' Blood (Guild Hunter, #1)",https://www.goodreads.com/book/show/3819326-angels-blood
"One Foot in the Grave (Night Huntress, #2)",https://www.goodreads.com/book/show/2168860.One_Foot_in_the_Grave
"The Summoning (Darkest Powers, #1)",https://www.goodreads.com/book/show/2800905-the-summoning
"Blood Bound (Mercy Thompson, #2)",https://www.goodreads.com/book/show/285205.Blood_Bound
"Onyx (Lux, #2)",https://www.goodreads.com/book/show/13047090-onyx
"Lover Enshrined (Black Dagger Brotherhood, #6)",https://www.goodreads.com/book/show/1240662.Lover_Enshrined
"Definitely Dead (Sookie Stackhouse, #6)",https://www.goodreads.com/book/show/140079.Definitely_Dead
"Bloodfever (Fever, #2)",https://www.goodreads.com/book/show/344262.Bloodfever
"Anna Dressed in Blood (Anna, #1)",https://www.goodreads.com/book/show/9378297-anna-dressed-in-blood
"All Together Dead (Sookie Stackhouse, #7)",https://www.goodreads.com/book/show/140075.All_Together_Dead
"Clockwork Princess (The Infernal Devices, #3)",https://www.goodreads.com/book/show/18335634-clockwork-princess
"Cry Wolf (Alpha & Omega, #1)",https://www.goodreads.com/book/show/2355575.Cry_Wolf
"Interview with the Vampire (The Vampire Chronicles, #1)",https://www.goodreads.com/book/show/43763.Interview_with_the_Vampire
"The Dream Thieves (The Raven Cycle, #2)",https://www.goodreads.com/book/show/17347389-the-dream-thieves
"Iron Kissed (Mercy Thompson, #3)",https://www.goodreads.com/book/show/1412138.Iron_Kissed
"Guilty Pleasures (Anita Blake, Vampire Hunter, #1)",https://www.goodreads.com/book/show/30281.Guilty_Pleasures
"Faefever (Fever, #3)",https://www.goodreads.com/book/show/2702704-faefever
"Lover Avenged (Black Dagger Brotherhood, #7)",https://www.goodreads.com/book/show/5098079-lover-avenged
"Hex Hall (Hex Hall, #1)",https://www.goodreads.com/book/show/5287473-hex-hall
"The Diviners (The Diviners, #1)",https://www.goodreads.com/book/show/7728889-the-diviners
"From Dead to Worse (Sookie Stackhouse, #8)",https://www.goodreads.com/book/show/2233407.From_Dead_to_Worse
"Bitten (Otherworld, #1)",https://www.goodreads.com/book/show/11918.Bitten
"Dead and Gone (Sookie Stackhouse, #9)",https://www.goodreads.com/book/show/5161066-dead-and-gone
"Paranormalcy (Paranormalcy, #1)",https://www.goodreads.com/book/show/7719245-paranormalcy
"The Darkest Night (Lords of the Underworld, #1)",https://www.goodreads.com/book/show/476543.The_Darkest_Night
"City of Heavenly Fire (The Mortal Instruments, #6)",https://www.goodreads.com/book/show/8755785-city-of-heavenly-fire
"Lover Mine (Black Dagger Brotherhood, #8)",https://www.goodreads.com/book/show/7046495-lover-mine
"Evermore (The Immortals, #1)",https://www.goodreads.com/book/show/3975774-evermore
"Bone Crossed (Mercy Thompson, #4)",https://www.goodreads.com/book/show/3128411-bone-crossed
"At Grave's End (Night Huntress, #3)",https://www.goodreads.com/book/show/3570231-at-grave-s-end
"Bloodlines (Bloodlines, #1)",https://www.goodreads.com/book/show/8709527-bloodlines
"Crescendo (Hush, Hush, #2)",https://www.goodreads.com/book/show/7791997-crescendo
"Storm Front (The Dresden Files, #1)",https://www.goodreads.com/book/show/47212.Storm_Front
"Shadowfever (Fever, #5)",https://www.goodreads.com/book/show/7304203-shadowfever
"Unearthly (Unearthly, #1)",https://www.goodreads.com/book/show/7488244-unearthly
"Opal (Lux, #3)",https://www.goodreads.com/book/show/13362536-opal
"Dreamfever (Fever, #4)",https://www.goodreads.com/book/show/6050298-dreamfever
"Dead in the Family (Sookie Stackhouse, #10)",https://www.goodreads.com/book/show/7091488-dead-in-the-family
The Graveyard Book,https://www.goodreads.com/book/show/2213661.The_Graveyard_Book
"Dead Witch Walking (The Hollows, #1)",https://www.goodreads.com/book/show/30264.Dead_Witch_Walking
"Night Pleasures (Dark-Hunter, #1)",https://www.goodreads.com/book/show/6944032-night-pleasures
"Once Burned (Night Prince, #1)",https://www.goodreads.com/book/show/7039218-once-burned
"Lover Unleashed (Black Dagger Brotherhood, #9)",https://www.goodreads.com/book/show/8492319-lover-unleashed
"Silver Borne (Mercy Thompson, #5)",https://www.goodreads.com/book/show/6587387-silver-borne
"Magic Burns (Kate Daniels, #2)",https://www.goodreads.com/book/show/1811543.Magic_Burns
"Feral Sins (The Phoenix Pack, #1)",https://www.goodreads.com/book/show/13522957-feral-sins
"Destined for an Early Grave (Night Huntress, #4)",https://www.goodreads.com/book/show/5604848-destined-for-an-early-grave
"Fantasy Lover (Hunter Legends, #1)",https://www.goodreads.com/book/show/84136.Fantasy_Lover
"Written in Red (The Others, #1)",https://www.goodreads.com/book/show/15711341-written-in-red
"Blue Lily, Lily Blue (The Raven Cycle, #3)",https://www.goodreads.com/book/show/17378508-blue-lily-lily-blue
Dracula,https://www.goodreads.com/book/show/17245.Dracula
"Magic Bleeds (Kate Daniels, #4)",https://www.goodreads.com/book/show/6479550-magic-bleeds
"Shadow of Night (All Souls, #2)",https://www.goodreads.com/book/show/11559200-shadow-of-night
"River Marked (Mercy Thompson, #6)",https://www.goodreads.com/book/show/8087906-river-marked
"Betrayed (House of Night, #2)",https://www.goodreads.com/book/show/676924.Betrayed
"Linger (The Wolves of Mercy Falls, #2)",https://www.goodreads.com/book/show/6654313-linger
"Some Girls Bite (Chicagoland Vampires, #1)",https://www.goodreads.com/book/show/4447622-some-girls-bite
"Lover Reborn (Black Dagger Brotherhood, #10)",https://www.goodreads.com/book/show/10993282-lover-reborn
"Pleasure Unbound (Demonica, #1)",https://www.goodreads.com/book/show/2679633-pleasure-unbound
"Dragon Bound (Elder Races, #1)",https://www.goodreads.com/book/show/9637479-dragon-bound
"The Warlord Wants Forever (Immortals After Dark, #0.5)",https://www.goodreads.com/book/show/6388558-the-warlord-wants-forever
"No Rest for the Wicked (Immortals After Dark, #2)",https://www.goodreads.com/book/show/14383.No_Rest_for_the_Wicked
"The Host (The Host, #1)",https://www.goodreads.com/book/show/1656001.The_Host
"Dead Reckoning (Sookie Stackhouse, #11)",https://www.goodreads.com/book/show/7981206-dead-reckoning
"Silence (Hush, Hush, #3)",https://www.goodreads.com/book/show/10637766-silence
"Kiss of Midnight (Midnight Breed,  #1)",https://www.goodreads.com/book/show/704043.Kiss_of_Midnight
"The Awakening (Darkest Powers, #2)",https://www.goodreads.com/book/show/5391115-the-awakening
"Lover at Last (Black Dagger Brotherhood, #11)",https://www.goodreads.com/book/show/13570854-lover-at-last
"The Iron King (The Iron Fey, #1)",https://www.goodreads.com/book/show/6644117-the-iron-king
"Torment (Fallen, #2)",https://www.goodreads.com/book/show/7740152-torment
"Frost Burned (Mercy Thompson, #7)",https://www.goodreads.com/book/show/13413589-frost-burned
"Origin (Lux, #4)",https://www.goodreads.com/book/show/13644052-origin
"Wicked Deeds on a Winter's Night (Immortals After Dark, #3)",https://www.goodreads.com/book/show/435045.Wicked_Deeds_on_a_Winter_s_Night
"Magic Slays (Kate Daniels, #5)",https://www.goodreads.com/book/show/8559047-magic-slays
"Chosen (House of Night, #3)",https://www.goodreads.com/book/show/1326258.Chosen
"Visions of Heat (Psy-Changeling, #2)",https://www.goodreads.com/book/show/215643.Visions_of_Heat
"The Laughing Corpse (Anita Blake, Vampire Hunter, #2)",https://www.goodreads.com/book/show/15309.The_Laughing_Corpse
"The Golden Lily (Bloodlines, #2)",https://www.goodreads.com/book/show/8709523-the-golden-lily
"This Side of the Grave (Night Huntress, #5)",https://www.goodreads.com/book/show/6871617-this-side-of-the-grave
"Dark Needs at Night's Edge (Immortals After Dark, #4)",https://www.goodreads.com/book/show/1611656.Dark_Needs_at_Night_s_Edge
"First Drop of Crimson (Night Huntress World, #1)",https://www.goodreads.com/book/show/6547187-first-drop-of-crimson
"Second Grave on the Left (Charley Davidson, #2)",https://www.goodreads.com/book/show/9565045-second-grave-on-the-left
"Archangel's Kiss (Guild Hunter, #2)",https://www.goodreads.com/book/show/6582637-archangel-s-kiss
"Glass Houses (The Morganville Vampires, #1)",https://www.goodreads.com/book/show/27266.Glass_Houses
"The Reckoning (Darkest Powers, #3)",https://www.goodreads.com/book/show/6468666-the-reckoning
The Short Second Life of Bree Tanner,https://www.goodreads.com/book/show/7937462-the-short-second-life-of-bree-tanner
"Lothaire (Immortals After Dark, #11)",https://www.goodreads.com/book/show/10790516-lothaire
"Hunting Ground (Alpha & Omega, #2)",https://www.goodreads.com/book/show/5292853-hunting-ground
"The Raven King (The Raven Cycle, #4)",https://www.goodreads.com/book/show/17378527-the-raven-king
The Coldest Girl in Coldtown,https://www.goodreads.com/book/show/12813630-the-coldest-girl-in-coldtown
"The Immortal Rules (Blood of Eden, #1)",https://www.goodreads.com/book/show/10215349-the-immortal-rules
"Days of Blood & Starlight (Daughter of Smoke & Bone, #2)",https://www.goodreads.com/book/show/12812550-days-of-blood-starlight
"World After (Penryn & the End of Days, #2)",https://www.goodreads.com/book/show/17849112-world-after
"Sweet Evil (Sweet, #1)",https://www.goodreads.com/book/show/11808950-sweet-evil
"Half-Blood (Covenant, #1)",https://www.goodreads.com/book/show/9680718-half-blood
"Born at Midnight (Shadow Falls, #1)",https://www.goodreads.com/book/show/8705784-born-at-midnight
"A Court of Thorns and Roses (A Court of Thorns and Roses, #1)",https://www.goodreads.com/book/show/50659467-a-court-of-thorns-and-roses
"Untamed (House of Night, #4)",https://www.goodreads.com/book/show/2866718-untamed
"Burn for Me (Hidden Legacy, #1)",https://www.goodreads.com/book/show/20705702-burn-for-me
"Forever (The Wolves of Mercy Falls, #3)",https://www.goodreads.com/book/show/9409458-forever
"Circus of the Damned (Anita Blake, Vampire Hunter, #3)",https://www.goodreads.com/book/show/30274.Circus_of_the_Damned
"The Indigo Spell (Bloodlines, #3)",https://www.goodreads.com/book/show/8709526-the-indigo-spell
"Caressed by Ice (Psy-Changeling, #3)",https://www.goodreads.com/book/show/458034.Caressed_by_Ice
"Deadlocked (Sookie Stackhouse, #12)",https://www.goodreads.com/book/show/10407279-deadlocked
"Ninth House (Alex Stern, #1)",https://www.goodreads.com/book/show/43263680-ninth-house
"Succubus Blues (Georgina Kincaid, #1)",https://www.goodreads.com/book/show/235718.Succubus_Blues
"Kiss of a Demon King (Immortals After Dark, #6)",https://www.goodreads.com/book/show/3585344-kiss-of-a-demon-king
"Demonglass (Hex Hall, #2)",https://www.goodreads.com/book/show/8428064-demonglass
"Wicked Lovely (Wicked Lovely, #1)",https://www.goodreads.com/book/show/305234.Wicked_Lovely
"The Evolution of Mara Dyer (Mara Dyer, #2)",https://www.goodreads.com/book/show/13643567-the-evolution-of-mara-dyer
"Dark Desires After Dusk (Immortals After Dark, #5)",https://www.goodreads.com/book/show/2003625.Dark_Desires_After_Dusk
"Night Broken (Mercy Thompson, #8)",https://www.goodreads.com/book/show/17562900-night-broken
"The Darkest Kiss (Lords of the Underworld, #2)",https://www.goodreads.com/book/show/2498983.The_Darkest_Kiss
"Blue Bloods (Blue Bloods, #1)",https://www.goodreads.com/book/show/872333.Blue_Bloods
"Night Embrace (Dark-Hunter, #2)",https://www.goodreads.com/book/show/6567284-night-embrace
"Third Grave Dead Ahead (Charley Davidson, #3)",https://www.goodreads.com/book/show/12043770-third-grave-dead-ahead
"The Lunatic Cafe (Anita Blake, Vampire Hunter, #4)",https://www.goodreads.com/book/show/30273.The_Lunatic_Cafe
"The Book of Life (All Souls, #3)",https://www.goodreads.com/book/show/16054217-the-book-of-life
"Demon from the Dark (Immortals After Dark, #9)",https://www.goodreads.com/book/show/7098304-demon-from-the-dark
"Shatter Me (Shatter Me, #1)",https://www.goodreads.com/book/show/10429045-shatter-me
"Dance with the Devil (Dark-Hunter, #3)",https://www.goodreads.com/book/show/84145.Dance_with_the_Devil
"Covet (Fallen Angels, #1)",https://www.goodreads.com/book/show/6289920-covet
"The King (Black Dagger Brotherhood, #12)",https://www.goodreads.com/book/show/18108281-the-king
"Lady Midnight (The Dark Artifices, #1)",https://www.goodreads.com/book/show/25494343-lady-midnight
"White Hot Kiss (The Dark Elements, #1)",https://www.goodreads.com/book/show/42246377-white-hot-kiss
"Changeless (Parasol Protectorate, #2)",https://www.goodreads.com/book/show/6933876-changeless
"Hunted (House of Night, #5)",https://www.goodreads.com/book/show/4134071-hunted
"Twice Tempted (Night Prince, #2)",https://www.goodreads.com/book/show/13125234-twice-tempted
"Harry Potter and the Philosopher’s Stone (Harry Potter, #1)",https://www.goodreads.com/book/show/72193.Harry_Potter_and_the_Philosopher_s_Stone
"Rhapsodic (The Bargainer, #1)",https://www.goodreads.com/book/show/25820414-rhapsodic
"Fair Game (Alpha & Omega, #3)",https://www.goodreads.com/book/show/7942786-fair-game
"Pleasure of a Dark Prince (Immortals After Dark, #8)",https://www.goodreads.com/book/show/6337006-pleasure-of-a-dark-prince
"One Grave at a Time (Night Huntress, #6)",https://www.goodreads.com/book/show/7954556-one-grave-at-a-time
"Fool Moon (The Dresden Files, #2)",https://www.goodreads.com/book/show/91477.Fool_Moon
"Beautiful Darkness (Caster Chronicles, #2)",https://www.goodreads.com/book/show/7842288-beautiful-darkness
"Finale (Hush, Hush, #4)",https://www.goodreads.com/book/show/12751687-finale
"Bloody Bones (Anita Blake, Vampire Hunter, #5)",https://www.goodreads.com/book/show/30241.Bloody_Bones
"Opposition (Lux, #5)",https://www.goodreads.com/book/show/13644055-opposition
"Acheron (Dark-Hunter, #14)",https://www.goodreads.com/book/show/2299110.Acheron
"Existence (Existence, #1)",https://www.goodreads.com/book/show/13223520-existence
"City of Ghosts (Cassidy Blake, #1)",https://www.goodreads.com/book/show/35403058-city-of-ghosts
"The Gathering (Darkness Rising, #1)",https://www.goodreads.com/book/show/7896345-the-gathering
"Magic Rises (Kate Daniels, #6)",https://www.goodreads.com/book/show/11544421-magic-rises
"Archangel's Consort (Guild Hunter, #3)",https://www.goodreads.com/book/show/7307503-archangel-s-consort
"Dark Prince (Dark, #1)",https://www.goodreads.com/book/show/28866.Dark_Prince
"Passion (Fallen, #3)",https://www.goodreads.com/book/show/9369720-passion
"Night Play (Dark-Hunter, #5; Were-Hunter, #1)",https://www.goodreads.com/book/show/84151.Night_Play
"The Killing Dance (Anita Blake, Vampire Hunter, #6)",https://www.goodreads.com/book/show/30244.The_Killing_Dance
"Clean Sweep (Innkeeper Chronicles, #1)",https://www.goodreads.com/book/show/19090384-clean-sweep
"Dead Ever After (Sookie Stackhouse, #13)",https://www.goodreads.com/book/show/15985348-dead-ever-after
"Dreams of a Dark Warrior (Immortals After Dark, #10)",https://www.goodreads.com/book/show/8534799-dreams-of-a-dark-warrior
"A Great and Terrible Beauty (Gemma Doyle, #1)",https://www.goodreads.com/book/show/3682.A_Great_and_Terrible_Beauty
"Kiss of Snow (Psy-Changeling, #10)",https://www.goodreads.com/book/show/8712343-kiss-of-snow
"Branded by Fire (Psy-Changeling, #6)",https://www.goodreads.com/book/show/5628753-branded-by-fire
"Fourth Grave Beneath My Feet (Charley Davidson, #4)",https://www.goodreads.com/book/show/13538992-fourth-grave-beneath-my-feet
"Hostage to Pleasure (Psy-Changeling, #5)",https://www.goodreads.com/book/show/3115070-hostage-to-pleasure
"Mine to Possess (Psy-Changeling, #4)",https://www.goodreads.com/book/show/1830755.Mine_to_Possess
"Tempted (House of Night, #6)",https://www.goodreads.com/book/show/6262365-tempted
"Burn (Dark in You, #1)",https://www.goodreads.com/book/show/25828477-burn
"Friday Night Bites (Chicagoland Vampires, #2)",https://www.goodreads.com/book/show/6319978-friday-night-bites
"The Fiery Heart (Bloodlines, #4)",https://www.goodreads.com/book/show/9833184-the-fiery-heart
"The Body Finder (The Body Finder, #1)",https://www.goodreads.com/book/show/6261522-the-body-finder
"Murder of Crows (The Others, #2)",https://www.goodreads.com/book/show/17563080-murder-of-crows
"Eternal Kiss of Darkness (Night Huntress World, #2)",https://www.goodreads.com/book/show/6871616-eternal-kiss-of-darkness
"Burnt Offerings (Anita Blake, Vampire Hunter, #7)",https://www.goodreads.com/book/show/30242.Burnt_Offerings
"Magic Strikes (Kate Daniels, #3)",https://www.goodreads.com/book/show/4345498-magic-strikes
The Haunting of Hill House,https://www.goodreads.com/book/show/89717.The_Haunting_of_Hill_House
"The Vampire Lestat (The Vampire Chronicles, #2)",https://www.goodreads.com/book/show/43814.The_Vampire_Lestat
"Blameless (Parasol Protectorate, #3)",https://www.goodreads.com/book/show/7719355-blameless
"Undead and Unwed (Undead, #1)",https://www.goodreads.com/book/show/421129.Undead_and_Unwed
"Fifth Grave Past the Light (Charley Davidson, #5)",https://www.goodreads.com/book/show/15813668-fifth-grave-past-the-light
"The Darkest Pleasure (Lords of the Underworld, #3)",https://www.goodreads.com/book/show/2712967-the-darkest-pleasure
"On the Edge (The Edge, #1)",https://www.goodreads.com/book/show/6329547-on-the-edge
"My Soul to Take (Soul Screamers, #1)",https://www.goodreads.com/book/show/6315602-my-soul-to-take
"The Good, the Bad, and the Undead (The Hollows, #2)",https://www.goodreads.com/book/show/30262.The_Good_the_Bad_and_the_Undead
"Die for Me (Revenants, #1)",https://www.goodreads.com/book/show/9462812-die-for-me
"Nightshade (Nightshade, #1; Nightshade World, #4)",https://www.goodreads.com/book/show/7402393-nightshade
"Fighting Destiny (The Fae Chronicles, #1)",https://www.goodreads.com/book/show/17927559-fighting-destiny
"Stolen (Women of the Otherworld, #2)",https://www.goodreads.com/book/show/11922.Stolen
"Spell Bound (Hex Hall, #3)",https://www.goodreads.com/book/show/11454587-spell-bound
"Hallowed (Unearthly, #2)",https://www.goodreads.com/book/show/11563110-hallowed
Midnight Sun [2008 Draft],https://www.goodreads.com/book/show/4502877-midnight-sun-2008-draft
"Pestilence (The Four Horsemen, #1)",https://www.goodreads.com/book/show/41831210-pestilence
"Desire Unchained (Demonica, #2)",https://www.goodreads.com/book/show/4497978-desire-unchained
"Kiss of the Night (Dark-Hunter, #4)",https://www.goodreads.com/book/show/17332310-kiss-of-the-night
"Seize the Night (Dark-Hunter, #6)",https://www.goodreads.com/book/show/84154.Seize_the_Night
The Shining,https://www.goodreads.com/book/show/11588.The_Shining
"Obsidian Butterfly (Anita Blake, Vampire Hunter, #9)",https://www.goodreads.com/book/show/190361.Obsidian_Butterfly
Carrie,https://www.goodreads.com/book/show/10592.Carrie
"The Name of the Star (Shades of London, #1)",https://www.goodreads.com/book/show/13595639-the-name-of-the-star
"Vicious (Villains, #1)",https://www.goodreads.com/book/show/40874032-vicious
"Blue Moon (Anita Blake, Vampire Hunter, #8)",https://www.goodreads.com/book/show/30246.Blue_Moon
"Shadowland (The Mediator, #1)",https://www.goodreads.com/book/show/187811.Shadowland
"Hollow City (Miss Peregrine's Peculiar Children, #2)",https://www.goodreads.com/book/show/23164983-hollow-city
"A Quick Bite (Argeneau, #1)",https://www.goodreads.com/book/show/38568.A_Quick_Bite
"Magic Breaks (Kate Daniels, #7)",https://www.goodreads.com/book/show/12119529-magic-breaks
"Fire Touched (Mercy Thompson, #9)",https://www.goodreads.com/book/show/25776210-fire-touched
Midnight Sun,https://www.goodreads.com/book/show/53287484-midnight-sun
"Every Which Way But Dead (The Hollows, #3)",https://www.goodreads.com/book/show/30263.Every_Which_Way_But_Dead
"Here Be Sexist Vampires (Deep In Your Veins, #1)",https://www.goodreads.com/book/show/13421072-here-be-sexist-vampires
"Unleash the Night (Dark Hunter, #8; Were-Hunter, #2)",https://www.goodreads.com/book/show/84139.Unleash_the_Night
"Burned (House of Night, #7)",https://www.goodreads.com/book/show/6917952-burned
"From Blood and Ash (Blood and Ash, #1)",https://www.goodreads.com/book/show/52831200-from-blood-and-ash
"End of Days (Penryn & the End of Days, #3)",https://www.goodreads.com/book/show/18500665-end-of-days
"Silver Shadows (Bloodlines, #5)",https://www.goodreads.com/book/show/8709524-silver-shadows
"A Court of Mist and Fury (A Court of Thorns and Roses, #2)",https://www.goodreads.com/book/show/50659468-a-court-of-mist-and-fury
"A Kiss of Shadows (Merry Gentry, #1)",https://www.goodreads.com/book/show/139417.A_Kiss_of_Shadows
"This Savage Song (Monsters of Verity, #1)",https://www.goodreads.com/book/show/40642172-this-savage-song
"Kiss of Crimson (Midnight Breed, #2)",https://www.goodreads.com/book/show/715791.Kiss_of_Crimson
"Heart of Obsidian  (Psy-Changeling, #12)",https://www.goodreads.com/book/show/15781026-heart-of-obsidian
"Grave Witch (Alex Craft, #1)",https://www.goodreads.com/book/show/7823038-grave-witch
"Twice Bitten (Chicagoland Vampires, #3)",https://www.goodreads.com/book/show/7060582-twice-bitten
"Grave Sight (Harper Connelly, #1)",https://www.goodreads.com/book/show/58077.Grave_Sight
"Everneath (Everneath, #1)",https://www.goodreads.com/book/show/9413044-everneath
"Supernaturally (Paranormalcy, #2)",https://www.goodreads.com/book/show/8581936-supernaturally
"Harry Potter and the Chamber of Secrets (Harry Potter, #2)",https://www.goodreads.com/book/show/15881.Harry_Potter_and_the_Chamber_of_Secrets
"Grave Peril (The Dresden Files, #3)",https://www.goodreads.com/book/show/91476.Grave_Peril
