Uid,Title,Reviewer,N_Review,N_Follower,Review_Rate,Review_Date,Content,N_Likes,N_Comments
62291,A Storm of Swords,Nataliya,710,11300,5,"December 4, 2013","
  This book made me want to throw it against the wall in anger and disbelief.
 It made me root for the death of a child (and then despise myself), love a hated character, cry angry tears, and bite my nails because of all the suspense. **Pictograhically, all of the above was happening to me.**I did not throw the book across the room. Instead, I put it aside and stared at the wall for a few minutes in grief and disbelief. If you read this, you know which part I am talking about *SOBBING* Then I picked it up again, because at that point I was so hooked that nothing could have stopped me. (I also MAY HAVE cut my neurobiology class to finish it. I know, I'm bad, very very bad.) Ah, you guys... Look at you, all innocent, before this book rips into you...A Storm of Swords is, in my opinion, an undisputed high point of the series so far. It expanded the story in delightful, wonderful ways. It gave it a truly epic feel. It delivered the cruel punch in the gut with the Red Wedding  (excuse me as I go and cry myself to sleep) and reinforced the axiom that nobody is safe in the world GRRM created. (*) * It was heartbreaking, gut-wrenching, and unexpected. But it was necessary, even if just to remind how cruel and brutal this world is, and how little choices can have huge consequences.
 I loved this book because of the amount of promise it brought to the series. It brought our characters to the brink of greatness, put them in the positions that were surely going to change the course of this entire story.  Examples: Jon and Dany. It was amazing to see how these two very young characters grew and developed due to all the battles, losses, and betrayals that they suffered. Both of them at the end of this story carry such potential for the future of this series. Having read book 5, I think that so much of it was unfortunately wasted.   Ah, our favorite despicable Lannisters... Look at you BEFORE all the hell broke loose for you. Does it make you feel any sympathy for the Starks now? No? I thought so.The character complexity parallels the story complexity - both are done masterfully. The characters feel alive and real. They are interesting and fascinating, and fluctuate between likable and despicable in a not too predictable fashion (*). The previously unseen connections between characters and events are mind-blowing. And seeing the select few skillfully manipulating so many others is unsettling. * Let me use Jaime and Tyrion as my examples here: 
Jaime became one of my favorites: understanding where he's coming from and seeing him humbled by his experience changed him from a monster to a deeply flawed but ultimately sympathetic man. (What he did to Bran was terrible - but child's play in comparison of all the other mindf***ery GRRM gives us in this book. What he does with his sister - gross, but they are competent and consenting adults, and it's not my place to judge them). Tyrion, on the other hand... What he did to Shae reminded me that darkness can live inside everyone, even our favorite Imp. Tywin, however - I did not give a crap about him (pun intended!), but Shae...Not cool. -------------------------------------------------------------------------Don't get me wrong. I gush about it, but this book is far from perfect. Just like its sequels (and predecessors) it suffers from overload of descriptions and repetitions, gratuitous bodily functions and banquets. Some storylines already begin to drag (Arya, for instance). But most of the faults were easily overshadowed by the great characterization, masterful story, and wonderfully built suspense. This is what I felt was unfortunately missing from the books that followed, and what I hope they return to eventually. 
  5 stars from my (many moons ago) yet-not-jaded self that happily gobbled up this delicious brain candy.
[""br""]>[""br""]>[""br""]>[""br""]>[""br""]>[""br""]>[""br""]>[""br""]>[""br""]>[""br""]>[""br""]>[""br""]>[""br""]>[""br""]>[""br""]>[""br""]>[""br""]>[""br""]>[""br""]>[""br""]>[""br""]>",673,75
62291,A Storm of Swords,Jayson,"1,515",3230,5,"March 24, 2022","(A) 88% | ExtraordinaryNotes: This is where the story explodes; two outstanding scenes highlight a truly audacious, epic and consequential volume.",683,26
62291,A Storm of Swords,Jayson,"1,515",3230,5,"April 14, 2022","(A) 88% | ExtraordinaryNotes: A tour de force of What the F’s, it’s full of blighted beddings, horrid japes, abrupt escapes, and bloody awful weddings.",547,30
62291,A Storm of Swords,Petrik,654,39700,5,"January 29, 2023","I have a Booktube channel now! Subscribe here: https://www.youtube.com/petrikleoAn absolutely merciless and brilliant masterwork.This was unbelievably amazing. A Storm of Swords could actually be the height of George R. R. Martin’s writing career. I know I haven’t read A Feast for Crows, A Dance with Dragons, or the extra books of the series yet. But realistically speaking, it would be bloody difficult for Martin to top what he has achieved in this book.Picture: A Storm of Swords by Marc SimonettiI’ll try to make this review shorter than usual, and I won’t be talking about the story at all to avoid spoilers. Seriously, you have to experience this for yourself. If you miraculously haven’t watched the TV series yet, A Storm of Swords encompassed seasons 3 and 4 of the TV series. I have known the main twists and turns of this volume due to watching the TV show first, but somehow this incredible novel was still able to fully capture my attention. It brings me to this point once again: I can’t even imagine how much I’ll love this traumatizing book IF I’ve read it without having watched the TV series adaptation.
  
    “Old stories are like old friends, she used to say. You have to visit them from time to time.”
  
This, of course, doesn’t mean that you should skip the TV series. Up to season 4, the TV series adaptation remains mostly loyal to the original material. Sure it’s not like the scene by scene adaptation portrayed in the first season anymore, but I do honestly think that there were some moments that the TV series did even better than the book, and vice versa. I totally loved what I’ve read so far in A Song of Ice and Fire; this novel, in particular, is currently my favorite within the series, and that’s saying a lot. From my experience reading the series, Martin’s prose during his battle scenes were great, but I personally feel there are other grimdark fantasy authors—like Joe Abercrombie, Jeff Salyards, and Steven Erikson—that writes superior battle scenes compared to Martin’s. The battle scenes were one factor where the TV show excelled. Also, I will never stop praising Peter Dinklage’s acting performance as Tyrion Lannister. I found that the acting exhibited by Peter Dinklage and many other actors/actresses in the TV show did sufficient justice to the superb characterizations that Martin gave to the characters of the series.
  
    “Rhaegar fought valiantly, Rhaegar fought nobly, Rhaegar fought honorably. And Rhaegar died.”
  
The main reasons why I loved reading the series is not because of the battle scenes, but for the terrific characterizations, intricate world-building, how Martin deftly set up each scene, and most of all, the immense strength in the unpredictability of the storyline; all proven clearly within this book. The myriad pivotal events that occurred in this single installment were simply insane and unforgettable. The Red Wedding, for example, is one of the most traumatizing events to ever transpired in a fantasy novel for me; it has pretty much become a standard of comparison for believable brutality and shocking scale in speculative fiction. “It wasn’t as crazy as The Red Wedding,” or “It was more traumatizing than The Red Wedding.” You probably have read or heard these phrases on reviews or on social media often—lately more so due to the super exposure caused by the TV shows; let me assure you that they’re there for many valid reasons.
  
    “It all goes back and back,"" Tyrion thought, ""to our mothers and fathers and theirs before them. We are puppets dancing on the strings of those who came before us, and one day our own children will take up our strings and dance in our steads.”
  
At 424k words—it took me about 23 hours to read—in total, A Storm of Swords has become the third biggest novel I’ve read so far after The Stand by Stephen King and Oathbringer by Brandon Sanderson. It’s truly astounding that there were close to zero dull moments in a novel this massive; I didn’t really enjoy Bran’s storyline, but his appearances here were relatively small. Excluding Bran’s story, I was completely immersed, and I was in love with every page I read. Martin sang a song of violence, grief, and treachery with spellbinding impacts; the writing was thoroughly engaging, filled with a plethora of memorable passages, and the phrases were cleverly structured to be evocative.
  
    “The greatest fools are ofttimes more clever than the men who laugh at them.”
  
Excluding the fame he gets from the TV series adaptation, if you’re ever in need of evident proofs on why George R. R. Martin has become one of the most legendary fantasy authors of our time, A Storm of Swords is the answer. The series indeed remains unfinished to this day, and there’s a chance it might not ever be finished, but I utterly believe that the series is worth your time despite that. The first three books—especially this one—in A Song of Ice and Fire provided an exceptional reading experience that epic fantasy readers should gain. I unquestionably loved A Storm of Swords. I'm giving this tome a full 5 stars rating, and I'm extremely confident it would've earned one of those ultra-rare 6 out of 5 stars rating from me if I'd read it without watching the TV series adaptation first. I expect I will end up loving A Storm of Swords more on future subsequent reread. This is truly a phenomenal magnum opus. Do yourself a favor. Read it, simple as that.You can order the book from: Book Depository (Free shipping)You can find this and the rest of my reviews at Novel NotionsSpecial thanks to my Patrons on Patreon for giving me extra support towards my passion for reading and reviewing!My Patrons: Alfred, Alya, Annabeth, Blaise, Devin, Diana, Edward, Hamad, Helen, Jimmy Nutts, Joie, Lufi, Michelle, Mike, Miracle, Nicholas, Zoe.",523,58
62291,A Storm of Swords,mark monday,"1,619",4955,5,"September 30, 2014","it's time again for... A Game of Heroes and Zeroes! spoilers ahead__________HEROES
  
he's the Revenant Robin Hood, leader of a band of merry men whose purpose is to steal from the wicked, give to the needy, ransom the royalty, hang the bad guys, and maybe get laid some. Lord Beric comes equipped with a nifty super-power (courtesy of the Lord of Light, 'natch)... he gets to come back from the dead! unfortunately, his various hideous wounds get to come back with him. but so what... all those scars (and missing eye, and noose-blackened neck, and crushed-in head) only make him more manly. he's just the dreamiest!
  
so what if she's socially awkward, mulishly stubborn, and entirely unimaginative... this young miss may be the last remaining True Knight in the realm! she kicks some serious ass, is loyal to a fault, and she brings out the human in that Jaime Lannister. at one point she stops to take a break by burying some random dead people hanging from a tree. what a big heart she has, it's adorable. you go, girl!
  
ha, ha - you thought he was the villain! joke's on you, sucker/reader. this gifted songster is not only the leader of the Free Folk (and what's not to like about them? they believe in freedom, equality, and the pursuit of happiness - even their tendency to steal women is sorta charming)... he is a man who turned his back on the rigid class system and general stuck-upedness of Westeros society for the charms of anarchic wildlings. he's just trying to get all his people away from those infernal Others. goodbye, mysterious villain... hello, brave hero!
  
sure, her eyes glow red. sure, she's a little bloodthirsty. sure, she wants to sacrifice some children. what of it? we all have our flaws. don't judge this sorceress... her only goal is to, um, SAVE THE ENTIRE WORLD FROM UTTER DESTRUCTION. have some sympathy for her goals already. it's not like you could do a better job at trying to SAVE THE ENTIRE WORLD FROM UTTER DESTRUCTION. i want her on my team!***~ and a special shout-out to classy old-timer Lady Olenna, Queen of Thorns. well finally someone realizes that King Joffrey's shenanigans are truly intolerable. extra bonus points for naming your personal bodyguards ""Left"" and ""Right"". ~__________ZEROES
  
hey, King Asshole, ever hear of keeping your word? seriously, Promiseslayer, what's wrong with you? you may win your battles, but you break your vow over a little punani? and what's up with chopping off the head of your own bannerman? not too bright, son. and all the good intentions in the world doesn't excuse your tendency towards Usurping the Rightful King. duh. my gosh, as far as common sense goes... the apple sure doesn't fall far from the tree.
  
good grief, two winners in one family - those lucky Starks! hmmm, let's see... you capture the wrong guy in book 1... you free an enemy in book 2... you seriously underestimate the most obvious ""secret"" villain in the world in book 3. what the hey? clearly you should have retired years ago. but i sense some redemption in your future. i know you have some bloodthirstiness in you, so let that freak flag fly in book 4 and get down to some serious villain-killing already!
  
wow, i used to love you so much. until i realized you were getting sorta inappropriate with Danerys. yeah, she's brave and beautiful and a queen and she frees entire cities worth of slaves and she has three lovely dragons. but didn't you notice that she's about a third your age? and on top of that, you're a jealous liar. get outta here, Creepy McCreeperson!
  
come on, wolfie - Arya is supposed to be your soulmate! she's running all over Westeros just trying to get back to the fam, clearly needing a helping hand or paw... so why are you off galivanting about the countryside, chasing deer and hanging out with your new wolfpack buddies? well you did save her ass by taking down some of those Brave Companions - but that's a case of too little, too late. and here i thought that wolves are a girl's best friend. silly me. i guess your stomach is so much more important.***~ a special Zero mention must be made for Tyrion the Imp. where did that brain of yours go? why are you getting your ass handed to you again and again? well at least you unstuck your head from that ass and finally delivered some seriously overdue comeuppance... but i had to read 900 pages to get to that part. i want my old Tyrion back, stat! ~__________no review necessary, there are enough excellent ones out there. i loved this book, as i loved its predecessors. my favorite parts were the scenes with Sandor Clegane and Arya Stark. those two vicious killers were made for each other and their relationship was both laugh-out-loud funny and strangely moving. awww. at long last, a father figure that a child can truly look up to, and a daughter surrogate who knows what it means to really, really want to get some payback. and now on to the next one!",410,69
62291,A Storm of Swords,Melissa ♥ Dog/Wolf Lover ♥ Martin,"3,365",9426,5,"December 3, 2017","Freaking awesome re-read!**OKAY, SPOILERS FOR THOSE THAT HAVEN'T READ IT YET**Reading this was cray because I keep looking to see if I had read it before! I thought why is so much of this familiar. Then I thought, ""Oh yeah, stupid, you own and have watched all of the current shows!"" <--- I mean duh! I was going to give this one 4 stars because it's the one where they kill more of the Stark's and wolf and I wanted to go in, turn into my own dragon and burn them all down! but then . . . THIS ↓Oh happy day! Oh happy day! What joy!!!!!!!!!!!!!!!!! ❤I love so many people on the show and in the books. But my favorites are: 1) Jon ❤2) Tyrion3) Arya4) Daenerys5) Brienne6) Sam7) Sansain no particular order because I tried that one already. In the book there were certain scenes I liked better than I did in the shows. I love the shows and I love the books so far. But, in this book there were more parts with dialogue that I really enjoyed. My favorite in this book were the scenes between Brienne and Jaime. I know, you didn't see that coming right? I mean you would think it would have been all the parts about Jon since he's my hunneh bunneh but nope. I liked his parts better in the show and nooo it's not because I can look at him in the show. Although. . . nevermind. I just felt like there was so much more to Brienne and Jaime's time together in the book. I wished he would have quit calling her ugly and such though. Jerk, but they did seem to be friends of a sort at the end of their time and I liked that. The things you miss in any book is the commentary in someone's head. Of course some I would rather not read about. But I really loved the parts where we could read Tyrion's thoughts about Sansa. They were sweet and true and sad in many ways. Overall I enjoyed the book because of the parts with Joffrey dying. Bwhahahahaahahahahahahah! And the parts with Brienne and Jaime. I loved all of my other characters parts but these were the highlight moments for me. Or course you know when you get rid of one evil b•stard, along comes another one!MY BLOG: Melissa Martin's Reading List",281,27
