Uid,Title,Reviewer,N_Review,N_Follower,Review_Rate,Review_Date,Content,N_Likes,N_Comments
35553325,Anything but Minor,Rachel Reads Ravenously,"1,787",2130,4,"July 16, 2016"," 4.5 stars!!! I always know one thing going into a Kate Stewart book: she's gonna leave me with a big old smile on my face.  ""I'm not sure what you want me to think of you, Rafe.""""I'm pretty sure I just want you to think of me, Alice.""  Anything But Minor is about a woman named Alice who has left Ohio to live in Charleston and has a new career as a flight instructor. Having been sheltered by her mother her entire life, Charleston is Alice's chance to live free and discover new things. On a whim, she attends a baseball game for the local minor league team where she meets Rafe, the star pitcher. Rafe makes it clear from the beginning he is interested in Alice, but Alice wants something more substantial than a fling. The two agree to be friends but there is an attraction between them that Rafe doesn't want to deny. ​  ""I may be wrong about you, I think. I thought you were one of those bone-headed, stupid athletes who only cared about baseball and women. But I have a feeling you're worth knowing.""  I really loved reading the progression of the relationship between Rafe and Alice, their adventures together and the little moments where they got to know each other. Alice is quirky and nerdy and I loved her. I loved that Rafe embraced her nerdiness and quirks, and he saw how her past made her the woman she was. Rafe, he was quite the hero. Friendly, strong, and determined, I also loved that he was a big dude! Cause I like my alpha males and all. The side characters are a delightful cherry on top and I am dying to see them again. I really want to see more from Kristina as I adored her friendship with Alice. The VHS tapes at the beginning of the chapters were another awesome touch to the book, in fact this entire book just made me want to sit down and watch 80's movies.Another great book from Kate Stewart and I look forward to what's to come!  ""I've got you.""""I've got you, too.""   ARC provided by author in exchange for an honest review ",66,26
35553325,Anything but Minor,Stacey,"1,447",1162,5,"November 18, 2016","Do you trust me?Well…do you trust me? I’m sure you’re all saying…sure Sassy, in a very superficial (here she goes again with her dribble about who knows what) way. Do you think we hear “Do you trust me?” – or- “Don’t you trust me?” too much? Are we handing over our trust without thought? Do we know a pilot before we board a plane and whether that man or woman deserves our trust? Or the driver in the car behind who may or may not have had enough sleep? I think we’ve stopped trusting in some respects and moved it to hope. We hope that the pilot/driver is deserving of the trust we put in them. I think trust must be earned. Trust should come after a person has seen you at your best and been proud to know you. Seen you at your nastiest and trusted that you’ll eventually get over yourself. Seen you nervous and held your hand. The person who wipes your tears and gives you a hug even if the tears are only there because the navy blue handbag you’d been eyeing for months has sold out and is discontinued. The person I trust the most earned it because he can keep a straight face while I tell him about cockroaches with spray tans, love at first sight, ""vegetarian"" vampires, motorcycle men with soft spots and even Scottish highland lairds who find a wee lassie to wrap in his kilt. That's not the only reason why I trust my hubby, he's earned it in hundreds of ways on hundreds of days. Luckily my hubby loves me even if I am a book nerd…or maybe it’s because. Ok, I did it again…I went off on a tangent that has practically nothing to do with the storyline…but it kind of does. How do you trust your heart to someone you think is too good for you or way out of your league? In Anything but Minor both the hero and the heroine have to learn to trust the feelings that have developed between them. When you’re looking at a woman who sets your heart alight, makes every day your best and thinks you are the best thing since sliced bread…how do you live up to that? When you’re looking at a man who has the opportunity of a lifetime away from you…how do you trust that he’s thinking about you as much as you’re thinking about him? Anything but Minor gets right to the heart of trusting someone and knowing whether you’ve put that trust in the right person.You won’t believe this (after all that heavy stuff I just spouted) but this book is by far one of the funniest books I’ve read this year. More than once I had tears pouring out of my eyes I was laughing so hard. The main chick in this book, Alice is an absolute crack up. She is on a mission to make every day the best day of her life. After growing up in a house with a bitter, self-righteous single mother, Alice has had enough and decides to take a job in a different town to spread her wings. She wants to experience all the things she’s been too scared to try in fear that God will strike her down for wicked thoughts. Alice has been lonely up till now and with this new move she wants to meet new people and have new adventures. When looking for her next adventure she ends up at a ball park watching her first game of baseball. The pitcher is awesome and she can’t believe it when she meets him at a bar afterwards…and completely humiliates herself.Rafe can’t believe this woman. She’s an absolute cutie and he wants her in a bad way. The things she does and says crack him up and make him feel things but he’s just about to get signed up for the majors and can’t afford to split his attentions. He tries to talk her into having a short term relationship aka a “quickie” but she wants no bar of him. Well, doesn’t she look a lot more appealing all of a sudden? He realises pretty quickly that he doesn’t want the short term relationship anymore, he wants every day to be their best day together.Kate Stewart has again given us a brilliant story. Anything but Minor is funny, sweet, steamy and heartwarming. This was another story where my boys had to know why I'm laughing so hard? My oldest who is 13 does the whole, rolling his eyes...knowing it's a love story so it can't be THAT funny. My nearly 10-year-old doesn't have the eye rolls but he does have the thong ready to wack cockroaches that have snuck in and are really funny. Of course, hubby knew there was no way I'd be laughing if there was a cockroach in my bedroom. It’s not all fun and it’s not all serious, it’s a wonderful blend of both that left a smile on my face and my heart fluttering. This story is a winner…cockroaches with fake tans and all.To buy Anything but Minor from Amazon - http://amzn.to/29ElkUMI’m an Aussie chick who loves to read and review romance, drink coffee, be a Style Setter and stalk David Gandy. To see more of my reviews, fashion, food and pervathons -    ",65,53
35553325,Anything but Minor,NMmomof4,"1,479",3483,4,"July 27, 2017"," 4 StarsOverall Opinion:  This was a super sweet, funny, and sexy read. I liked it a lot more than I thought I would. Initially, I had thought this was a erotic short story just by looking at the cover. It's a hot picture, but not normally what we see on a contemporary full length romance. I know, I know -- I am a judgy person ;). This doesn't get all that deep, but it served its purpose in making me happy while reading it. I'd definitely recommend for in-between some heavier reads!Brief Summary of the Storyline:  This is Alice and Rafe's story. Alice is new to town, and ends up at a minor league baseball game where she is befriended by an older woman. This woman ends up giving her a season seat, so she is thrown into the new sport. She finds herself at a pub that is owned by one of the players, and she meets Rafe who is the star pitcher. Sparks fly instantly, but Alice has stereotyped him as a manwhore (which wasn't far off) and isn't interested in a ONS. There is some pursuing going on, a friendship is formed, and then they get together and fall in love....and they eventually get a HEA ending.POV: This alternated between Alice and Rafe's POV.Overall Pace of Story:  Good. I never skimmed and I thought it flowed well.Instalove: No. They take a while to develop stronger feelings.H rating: 4 stars. Rafe. I liked him. I took a little bit to come around to liking him, but I ended up really liking his relationship with the h and how he treated her.h rating: 4 stars. Alice. She was super cute in her Google obsession. I especially loved it when they were going to his house to have sex for the first time and she is googling ways to blow his mind! Too cute.Sadness level: Low. No tissues needed.Push/Pull: Yes  The h doesn't want to be a ONS and appreciates the H's friendship, so she makes him work for her and pushes away a little. The H does a little pushing away at one point, but it doesn't last long and he ends up coming around. Heat level: Moderate. They have some steamy scenes and chemistry.Descriptive sex: YesSafe sex: Yes. Condoms are mentioned and then after a std status and birth control talk they go without. I don't remember any mention of past practices.OW/OM drama: Very mild  There is a bartender at the H's best friend's bar that has a thing for the H. She becomes friends with the h, but she never creates any drama with the h and H. The H and the OW have no sexual/romantic past.Sex scene with OW or OM: NoCheating: NoSeparation: No  They're only separated when the H is at away games. No mention or suggestion of other partners during this separation.Possible Triggers: Mild  Manwhore H before h and neglectful/controlling parents.Closure:  This actually had some good closure with a cute jump ahead epilogue and a HEA ending! Just what I like ;)How I got it: I paid the $2.99 on Amazon.Safety: I'd say that this should be Safe for most readers.- Does Not have cheating- Does Not have a descriptive sex scene with OW/OM-  Does have the H pushing the h away a little bit-  Does Not have a separation between the h and H (except when he leaves to play games, but they're still together)-  Does Not have abuse-  Does Not have OTT sad parts- Does  have a HEA ending",64,29
35553325,Anything but Minor,The Sassy Bookworm,"3,262",2268,4,"August 20, 2016","3.5 Stars...
  Anything But Minor
 is Kate Stewart's latest offering. After reading and enjoying 
  Loving The White Liar
 (We even get a brief cameo of the couple of that book in this one) I knew that I had to add this book to my neverending ""TO-READ"" list...
  ""The woman had managed to piss me off twice since I met her and had made a fool of me. Oh yes, there would be fucking""
Alice left Ohio and her mother's overbearing attitude to strike out on an adventure and finally be the Alice she was meant to be. Everyday she discovers something new, which leads her to a baseball game and Dutch. Mistakenly sitting in Dutch's dead husband's seat a friendship is built which leads her to one sexy as sin pitcher Rafe Hembrey. Rafe is a bit of a playboy and not someone Alice dares to get involved with. Alas, fate has other plans and soon the sparks are flying between these two....
  ""Well, have faith, Rafe. If a fourteen-inch seahorse can be monogamous, I’m sure there’s hope for you.""
 I enjoyed this one a lot. Alice was one of the best heroine's I have read in AGES. She was funny, and quirky (without being annoying) She had self respect and didn't just fall into Rafe's crotch the minute he said ""hello"" She really made the book for me. Rafe I liked a little less than Alice. It took me a little time to warm to him. He was a player, and to be honest I am getting a little tired of the whole ""sports hero player gig"" that seems to be in almost EVERY sports romance written lately. As much as I did enjoy this one, it did lose a star and a half for a few issues I had. There is a scene that annoyed me that involved another woman. Normally I don't concern myself with wondering about things that don't happen on the actual pages of the book (why bother right? If it was important to the story it would be included) That said there is a scene where Rafe leaves Alice to apparently go play ""naked poker"" with a woman whose ass he slapped earlier in front of Alice. The reason why I felt we needed clarification on whether he went back and played with the OW or not was because he was trying to present a non-player facade to Alice and if he did indeed go and play naked poker than he loses some points in my eyes for continuing his player ways while claiming to want Alice. Another thing that made NO SENSE to me was the whole ""Kristina"" situation. Until 80% of the book I never got an inkling that she was in love with Rafe. Even when her and Alice have a conversation about Rafe and whether they have ever slept together, she says she is hung up on ""someone else"" Even when Andy was angry at Rafe because he has a thing for Kristina, I was SURE she was in love with someone different and Andy was wrong. In FACT I actually thought she was in love with Andy. Then BAM, at 80% she is declaring these feelings of love. It just seemed SO unnecessary since she was Alice's friend and never caused any tension or trouble over the course of the book. I honestly am still scratching my head over the whole point of that plotline. Lastly the whole revelation about Dutch was a little too out of left field for me. I mean one would think SOMEONE would have brought it up before the very end of the book. I am not sure why it needed to be this big secret.So I know it sounds like a had a lot of problems with this one, but all those mentioned above where just annoyances in the big picture. I really did enjoy this one, and I really do enjoy this authors writing. I laughed my butt off SO many times. A hearty two thumbs up...",60,48
35553325,Anything but Minor,Dee Montoya,942,571,5,"July 14, 2016","*****5+++~Be Mine Stars(ARC kindly provided by author <3)Laugh out loud and utterly fantastic. Anything But Minor was everything I've been craving and much more. Kate Stewart has proven once again that not only is she a talented author but that she's also damn funny too!!This book delivered nothing but a good time! A total home run of a book!!!! 
  
Alice left her hometown behind and has moved to Charleston, South Carolina in search of a new life full of adventure. She grew up with a mother who was very strict and kept Alice sheltered from most things in life. Now Alice is ready to break free, with a wonderful list in hand of new things she wants to try.From the moment Alice steps down from the airplane, she starts to fall in love with Charleston, and we go along with her. The beautiful setting is so enchanting, it makes you want to hop on a plane, and go visit. In the spirit of trying new things, Alice finds herself at a local baseball game, where a strange older woman offers her a weekly seat to watch the games of their home team with her. And it is at that ballgame where Alice gets mesmerized by the most beautiful man she's ever seen; Rafe Hembrey. 
  
This is Rafe's year, the year he's been waiting for to sign with a major league team. His stats are better than ever, his career at its' peak, and everyone knows that sooner or later he's getting that call. Which is why he can't afford to get distracted by the bombshell/nerd/ Google obsessed woman he just met at one of his games. Alice knows Rafe has a reputation of love 'em and leave 'em, and she also knows that he might be leaving Charleston soon. So, after a few friendly dates, and even though the attraction is out of control intense between them, Alice decides she'd rather not lose Rafe's friendship since she knows all she can get from him is amazing sex. But Rafe has other plans, he wants in Alice's pants, but every minute he spends with her, makes him realize that he might actually want more.This story was as sweet and decadent as eating a chocolate cake, but without feeling guilty about the calories. The characters, the hilarious plot, and the setting made a magical combination that will charm the hearts of anybody who reads it.Rafe was sexy and delicious, but Alice was my most favorite thing about this book. Her character was totally adorable, smart and also very empowering, we need more female characters like her in books. Anything But Minor is a book that will leave you feeling happy. A book that you would want to share, gift and recommend, because it's so full of laughs and soul. This book is one item I'll have on my Christmas list to give to all my friends. I just LOVED it!!!
  
",58,31
35553325,Anything but Minor,Maida»-(¯`v´¯)-»,"1,666",421,5,"August 28, 2016","RATING: 5+ “No end” Hearts!! :D <3Anything But Minor is an easy, enjoyable read, giving us two equally quirky protagonists who bring a number of laugh out loud moments with their banter and a romance that combines the best of sweet and sexy as it transitions from friendship to intimacy.
  
     “You could really fuck me up, Rafe.”He only hesitated a second before he promised me, “I’ve got you.”“I’ve got you, too.” 
  
Alice makes us fall in love with her the moment she steps on page, a scene-stealer with her love of 80’s movies and penchant to Google everything that piques her interest. Though her strict upbringing kept her from experiencing the rambunctiousness that comes with being a teenager, she still somehow emerges with the ability to approach every situation in her adulthood with a joy for life we can only admire. She holds her head up high even when her new adventurous nature lands her in unexpected—albeit comical—predicaments time and again.
  
     She had a way of making me feel...everything, and not in small doses, but all at once. 
  
Rafe is everything a swoon-worthy sports romance hero should be; loyal, self-assured, and completely possessive, ensuring we’re as much impassioned by his determined seduction as is Alice. While he would have many a single lady clamoring for his attention, he only has eyes for Alice even when she continuously rejects his efforts to make her fall into his bed. While the romance is of the slow burn variety, we’re thankfully spared chapters of angst, instead Ms. Stewart allows us to sit back and simply enjoy their friendly flirtation and sexy come-ons until reaching the precipice of their sexual tension. 
  
     “I think you’re the most beautiful man on the planet. I think you’re a superior athlete. I think you play dumb a lot to keep from having to explain yourself. I think you’re passionate and considerate. I think you’re an amazing lover. I think you’re all heart on the ballfield and have a guarded heart off it...I think you’re incredible, Rafe Hembrey.” 
  
Overall, Anything But Minor is the kind of romance that brings a smile to our faces as much as it does a blush to our cheeks, anchoring both longtime readers of Kate Stewart and those new to her work (like myself) as eternal fans.Other Fave Quotes:“I’m not sure what you want me to think of you, Rafe.”“I’m pretty sure I just want you to think of me, Alice,” he said in a whisper.“If you keep waiting, baby, I’ll keep coming home.”“I’ve got you.”“I fucking love you.”“The world could disappear tomorrow and I’d only worry about a fucking tiny list of people. But the thing I would need in order to breathe again would be to see your face.”“Best day of my life.”“Every day.”“You were made for me. You fit me like a glove. I want you to always remember that.”“You. Are. Everything. My everything.”“Rafe?”“Yeah?”“Why me?”“It could only be you.”
  Posted: August 26, 2016
",56,80
