Title,URL
Joy of Cooking,https://www.goodreads.com/book/show/43822015-joy-of-cooking
"Salt, Fat, Acid, Heat: Mastering the Elements of Good Cooking",https://www.goodreads.com/book/show/30753841-salt-fat-acid-heat
Mastering the Art of French Cooking,https://www.goodreads.com/book/show/129650.Mastering_the_Art_of_French_Cooking
How to Cook Everything: Simple Recipes for Great Food,https://www.goodreads.com/book/show/603204.How_to_Cook_Everything
The Smitten Kitchen Cookbook: Recipes and Wisdom from an Obsessive Home Cook,https://www.goodreads.com/book/show/13331199-the-smitten-kitchen-cookbook
Plenty,https://www.goodreads.com/book/show/8086216-plenty
Jerusalem: A Cookbook,https://www.goodreads.com/book/show/13536517-jerusalem
"The Moosewood Cookbook: Recipes from Moosewood Restaurant, Ithaca, New York",https://www.goodreads.com/book/show/603422.The_Moosewood_Cookbook
Keto Diet for Beginners: 30-Day Keto Meal Plan for Rapid Weight Loss.,https://www.goodreads.com/book/show/42747550-keto-diet-for-beginners
Better Homes and Gardens New Cook Book,https://www.goodreads.com/book/show/411053.Better_Homes_and_Gardens_New_Cook_Book
Cravings: Recipes for All the Food You Want to Eat,https://www.goodreads.com/book/show/25982685-cravings
Thug Kitchen: The Official Cookbook: Eat Like You Give a F*ck,https://www.goodreads.com/book/show/20696032-thug-kitchen
Veganomicon: The Ultimate Vegan Cookbook,https://www.goodreads.com/book/show/1059680.Veganomicon
The Food Lab: Better Home Cooking Through Science,https://www.goodreads.com/book/show/24861842-the-food-lab
The Pioneer Woman Cooks: Recipes from an Accidental Country Girl,https://www.goodreads.com/book/show/6361871-the-pioneer-woman-cooks
Essentials of Classic Italian Cooking,https://www.goodreads.com/book/show/19552.Essentials_of_Classic_Italian_Cooking
Barefoot Contessa at Home: Everyday Recipes You'll Make Over and Over Again,https://www.goodreads.com/book/show/120230.Barefoot_Contessa_at_Home
"The Art of Simple Food: Notes, Lessons, and Recipes from a Delicious Revolution",https://www.goodreads.com/book/show/688663.The_Art_of_Simple_Food
How to Be a Domestic Goddess: Baking and the Art of Comfort Cooking,https://www.goodreads.com/book/show/39542.How_to_Be_a_Domestic_Goddess
Everyday Italian: 125 Simple and Delicious Recipes,https://www.goodreads.com/book/show/1192.Everyday_Italian
How to Cook Everything Vegetarian: Simple Meatless Recipes for Great Food,https://www.goodreads.com/book/show/1587362.How_to_Cook_Everything_Vegetarian
The Barefoot Contessa Cookbook,https://www.goodreads.com/book/show/3895.The_Barefoot_Contessa_Cookbook
Ottolenghi Simple: A Cookbook,https://www.goodreads.com/book/show/39797678-ottolenghi-simple
"The Flavor Bible: The Essential Guide to Culinary Creativity, Based on the Wisdom of America's Most Imaginative Chefs",https://www.goodreads.com/book/show/4443485-the-flavor-bible
Artisan Bread in Five Minutes a Day: The Discovery That Revolutionizes Home Baking,https://www.goodreads.com/book/show/1009996.Artisan_Bread_in_Five_Minutes_a_Day
The Pioneer Woman Cooks: Food from My Frontier,https://www.goodreads.com/book/show/12072362-the-pioneer-woman-cooks
Barefoot Contessa Back to Basics,https://www.goodreads.com/book/show/2815949-barefoot-contessa-back-to-basics
Momofuku,https://www.goodreads.com/book/show/6487388-momofuku
Plenty More: Vibrant Vegetable Cooking from London's Ottolenghi [A Cookbook],https://www.goodreads.com/book/show/20691056-plenty-more
Smitten Kitchen Every Day: Triumphant and Unfussy New Favorites,https://www.goodreads.com/book/show/31130686-smitten-kitchen-every-day
Magnolia Table: A Collection of Recipes for Gathering,https://www.goodreads.com/book/show/36381100-magnolia-table
Six Seasons: A New Way with Vegetables,https://www.goodreads.com/book/show/30754045-six-seasons
Flour Water Salt Yeast: The Fundamentals of Artisan Bread and Pizza,https://www.goodreads.com/book/show/13414492-flour-water-salt-yeast
Barefoot Contessa Family Style: Easy Ideas and Recipes That Make Everyone Feel Like Family,https://www.goodreads.com/book/show/120231.Barefoot_Contessa_Family_Style
Cravings: Hungry for More,https://www.goodreads.com/book/show/40004097-cravings
The Homemade Pantry: 101 Foods You Can Stop Buying and Start Making,https://www.goodreads.com/book/show/12519893-the-homemade-pantry
Half Baked Harvest Cookbook: Recipes from My Barn in the Mountains,https://www.goodreads.com/book/show/33571767-half-baked-harvest-cookbook
The Oh She Glows Cookbook: Over 100 Vegan Recipes to Glow from the Inside Out,https://www.goodreads.com/book/show/18079651-the-oh-she-glows-cookbook
Indian-ish: Recipes and Antics from a Modern American Family,https://www.goodreads.com/book/show/40796136-indian-ish
The Unofficial Harry Potter Cookbook: From Cauldron Cakes to Knickerbocker Glory--More Than 150 Magical Recipes for Wizards and Non-Wizards Alike,https://www.goodreads.com/book/show/8281069-the-unofficial-harry-potter-cookbook
The America's Test Kitchen Family Cookbook,https://www.goodreads.com/book/show/3888.The_America_s_Test_Kitchen_Family_Cookbook
Vegetarian Cooking for Everyone,https://www.goodreads.com/book/show/141051.Vegetarian_Cooking_for_Everyone
The Silver Palate Cookbook,https://www.goodreads.com/book/show/1107001.The_Silver_Palate_Cookbook
"Vegan with a Vengeance: Over 150 Delicious, Cheap, Animal-Free Recipes That Rock",https://www.goodreads.com/book/show/48303.Vegan_with_a_Vengeance
My Paris Kitchen: Recipes and Stories,https://www.goodreads.com/book/show/18209508-my-paris-kitchen
Dining In: Highly Cookable Recipes,https://www.goodreads.com/book/show/34272569-dining-in
On Food and Cooking: The Science and Lore of the Kitchen,https://www.goodreads.com/book/show/101255.On_Food_and_Cooking
Dessert Person: Recipes and Guidance for Baking with Confidence: A Baking Book,https://www.goodreads.com/book/show/52028349-dessert-person
I'm Just Here for the Food: Food + Heat = Cooking,https://www.goodreads.com/book/show/101249.I_m_Just_Here_for_the_Food
Nothing Fancy: Unfussy Food for Having People Over,https://www.goodreads.com/book/show/46011237-nothing-fancy
The Bread Baker's Apprentice: Mastering the Art of Extraordinary Bread,https://www.goodreads.com/book/show/39910.The_Bread_Baker_s_Apprentice
Vegan Cupcakes Take Over the World: 75 Dairy-Free Recipes for Cupcakes that Rule,https://www.goodreads.com/book/show/48304.Vegan_Cupcakes_Take_Over_the_World
Ottolenghi: The Cookbook,https://www.goodreads.com/book/show/15798165-ottolenghi
Tartine Bread,https://www.goodreads.com/book/show/8185785-tartine-bread
"The Pioneer Woman Cooks: Dinnertime: Comfort Classics, Freezer Food, 16-Minute Meals, and Other Delicious Ways to Solve Supper!",https://www.goodreads.com/book/show/24903909-the-pioneer-woman-cooks
Momofuku Milk Bar,https://www.goodreads.com/book/show/10679360-momofuku-milk-bar
"Half Baked Harvest Super Simple: More Than 125 Recipes for Instant, Overnight, Meal-Prepped, and Easy Comfort Foods: A Cookbook",https://www.goodreads.com/book/show/43888840-half-baked-harvest-super-simple
The Silver Spoon,https://www.goodreads.com/book/show/136599.The_Silver_Spoon
Food52 Genius Recipes: 100 Recipes That Will Change the Way You Cook,https://www.goodreads.com/book/show/22716562-food52-genius-recipes
Barefoot in Paris,https://www.goodreads.com/book/show/56913.Barefoot_in_Paris
The New Best Recipe,https://www.goodreads.com/book/show/24019.The_New_Best_Recipe
Baking: From My Home to Yours,https://www.goodreads.com/book/show/184644.Baking
Nourishing Traditions: The Cookbook that Challenges Politically Correct Nutrition and Diet Dictocrats,https://www.goodreads.com/book/show/117835.Nourishing_Traditions
The French Laundry Cookbook,https://www.goodreads.com/book/show/154556.The_French_Laundry_Cookbook
Modern Comfort Food: A Barefoot Contessa Cookbook,https://www.goodreads.com/book/show/51154724-modern-comfort-food
"Instant Pot Pressure Cooker Recipes Cookbook: Easy, Fast, Healthy and Delicious Recipes",https://www.goodreads.com/book/show/34510751-instant-pot-pressure-cooker-recipes-cookbook
"The Skinnytaste Cookbook: Light on Calories, Big on Flavor",https://www.goodreads.com/book/show/20707953-the-skinnytaste-cookbook
Super Natural Every Day: Well-Loved Recipes from My Natural Foods Kitchen [A Cookbook],https://www.goodreads.com/book/show/9326166-super-natural-every-day
BraveTart: Iconic American Desserts,https://www.goodreads.com/book/show/32191664-bravetart
"Nigella Express: Good Food, Fast",https://www.goodreads.com/book/show/468070.Nigella_Express
Oh She Glows Every Day: Quick and Simply Satisfying Plant-Based Recipes,https://www.goodreads.com/book/show/28186250-oh-she-glows-every-day
Around My French Table: More than 300 Recipes from My Home to Yours,https://www.goodreads.com/book/show/7847439-around-my-french-table
The Pioneer Woman Cooks: A Year of Holidays,https://www.goodreads.com/book/show/17349204-the-pioneer-woman-cooks
Rachael Ray 365: No Repeats: A Year of Deliciously Different Dinners,https://www.goodreads.com/book/show/3882.Rachael_Ray_365
Every Grain of Rice: Simple Chinese Home Cooking,https://www.goodreads.com/book/show/13707601-every-grain-of-rice
Fix-It and Forget-It Cookbook: Feasting with Your Slow Cooker,https://www.goodreads.com/book/show/852460.Fix_It_and_Forget_It_Cookbook
Ottolenghi Flavor: A Cookbook,https://www.goodreads.com/book/show/50669534-ottolenghi-flavor
"Isa Does It: Amazingly Easy, Wildly Delicious Vegan Recipes for Every Day of the Week",https://www.goodreads.com/book/show/17333291-isa-does-it
Ad Hoc at Home,https://www.goodreads.com/book/show/6391443-ad-hoc-at-home
Martha Stewart's Cookies: The Very Best Treats to Bake and to Share,https://www.goodreads.com/book/show/2176873.Martha_Stewart_s_Cookies
Make It Ahead: A Barefoot Contessa Cookbook,https://www.goodreads.com/book/show/20697389-make-it-ahead
Where Cooking Begins: Uncomplicated Recipes to Make You a Great Cook,https://www.goodreads.com/book/show/40712503-where-cooking-begins
Barefoot Contessa Foolproof: Recipes You Can Trust,https://www.goodreads.com/book/show/13531818-barefoot-contessa-foolproof
Jubilee: Recipes from Two Centuries of African American Cooking,https://www.goodreads.com/book/show/44461771-jubilee
Ratio: The Simple Codes Behind the Craft of Everyday Cooking,https://www.goodreads.com/book/show/3931154-ratio
"The Perfect Scoop: Ice Creams, Sorbets, Granitas, and Sweet Accompaniments",https://www.goodreads.com/book/show/261821.The_Perfect_Scoop
Barefoot Contessa: How Easy Is That?,https://www.goodreads.com/book/show/7865987-barefoot-contessa
Appetite for Reduction: 125 Fast and Filling Low-Fat Vegan Recipes,https://www.goodreads.com/book/show/8070469-appetite-for-reduction
The New Enchanted Broccoli Forest (Mollie Katzen's Classic Cooking),https://www.goodreads.com/book/show/178204.The_New_Enchanted_Broccoli_Forest
The Love and Lemons Cookbook: An Apple-to-Zucchini Celebration of Impromptu Cooking,https://www.goodreads.com/book/show/25982864-the-love-and-lemons-cookbook
Deceptively Delicious: Simple Secrets to Get Your Kids Eating Good Food,https://www.goodreads.com/book/show/1734639.Deceptively_Delicious
Giada's Family Dinners,https://www.goodreads.com/book/show/1191.Giada_s_Family_Dinners
The Whole30: The 30-Day Guide to Total Health and Food Freedom,https://www.goodreads.com/book/show/23453036-the-whole30
The Fannie Farmer Cookbook,https://www.goodreads.com/book/show/158944.The_Fannie_Farmer_Cookbook
Barefoot Contessa Parties! Ideas and Recipes for Easy Parties,https://www.goodreads.com/book/show/120232.Barefoot_Contessa_Parties_Ideas_and_Recipes_for_Easy_Parties
The King Arthur Flour Baker's Companion: The All-Purpose Baking Cookbook,https://www.goodreads.com/book/show/74044.The_King_Arthur_Flour_Baker_s_Companion
"Jamie's Food Revolution: Rediscover How to Cook Simple, Delicious, Affordable Meals",https://www.goodreads.com/book/show/6404708-jamie-s-food-revolution
Tartine,https://www.goodreads.com/book/show/114299.Tartine
Tartine,https://www.goodreads.com/book/show/114299.Tartine
The Way to Cook,https://www.goodreads.com/book/show/132688.The_Way_to_Cook
"100 Cookies: The Baking Book for Every Kitchen, with Classic Cookies, Novel Treats, Brownies, Bars, and More",https://www.goodreads.com/book/show/50998813-100-cookies
Mastering the Art of French Cooking: Vol. 2,https://www.goodreads.com/book/show/132692.Mastering_the_Art_of_French_Cooking
Jamie at Home: Cook Your Way to the Good Life,https://www.goodreads.com/book/show/1776251.Jamie_at_Home
The Cake Bible,https://www.goodreads.com/book/show/153136.The_Cake_Bible
The Bread Bible,https://www.goodreads.com/book/show/153142.The_Bread_Bible
Sweet,https://www.goodreads.com/book/show/34063669-sweet
Appetites: A Cookbook,https://www.goodreads.com/book/show/28925236-appetites
Ball Complete Book of Home Preserving,https://www.goodreads.com/book/show/843016.Ball_Complete_Book_of_Home_Preserving
Everyday Food: Great Food Fast,https://www.goodreads.com/book/show/335459.Everyday_Food
Cook with Jamie,https://www.goodreads.com/book/show/823412.Cook_with_Jamie
Vegetable Literacy: Cooking and Gardening with Twelve Families from the Edible Plant Kingdom,https://www.goodreads.com/book/show/15797974-vegetable-literacy
How to Eat: The Pleasures and Principles of Good Food,https://www.goodreads.com/book/show/39540.How_to_Eat
"Minimalist Baker's Everyday Cooking: 101 Entirely Plant-based, Mostly Gluten-Free, Easy and Delicious Recipes",https://www.goodreads.com/book/show/27833849-minimalist-baker-s-everyday-cooking
Vegetable Kingdom: The Abundant World of Vegan Recipes,https://www.goodreads.com/book/show/45895070-vegetable-kingdom
Nom Nom Paleo: Food for Humans,https://www.goodreads.com/book/show/17924086-nom-nom-paleo
Cook This Book: Techniques That Teach and Recipes To Repeat,https://www.goodreads.com/book/show/54895707-cook-this-book
The New Book of Middle Eastern Food,https://www.goodreads.com/book/show/394182.The_New_Book_of_Middle_Eastern_Food
The Complete Cooking For Two Cookbook,https://www.goodreads.com/book/show/18797099-the-complete-cooking-for-two-cookbook
Skinnytaste Fast and Slow: Knockout Quick-Fix and Slow-Cooker Recipes for Real Life,https://www.goodreads.com/book/show/28588001-skinnytaste-fast-and-slow
5 Ingredients – Quick  Easy Food,https://www.goodreads.com/book/show/35069206-5-ingredients-quick-easy-food
Madhur Jaffrey's World Vegetarian: More Than 650 Meatless Recipes from Around the World,https://www.goodreads.com/book/show/142849.Madhur_Jaffrey_s_World_Vegetarian
The Science of Good Cooking: Master 50 Simple Concepts to Enjoy a Lifetime of Success in the Kitchen (Cook's Illustrated Cookbooks),https://www.goodreads.com/book/show/14636971-the-science-of-good-cooking
"Afro-Vegan: Farm-Fresh African, Caribbean, and Southern Flavors Remixed",https://www.goodreads.com/book/show/18209510-afro-vegan
The Complete Vegetarian Cookbook,https://www.goodreads.com/book/show/24477075-the-complete-vegetarian-cookbook
Jeni's Splendid Ice Creams at Home,https://www.goodreads.com/book/show/10178769-jeni-s-splendid-ice-creams-at-home
East: 120 Vegan and Vegetarian recipes from Bangalore to Beijing,https://www.goodreads.com/book/show/44147081-east
In Bibi's Kitchen: The Recipes and Stories of Grandmothers from the Eight African Countries That Touch the Indian Ocean,https://www.goodreads.com/book/show/50482975-in-bibi-s-kitchen
Molly on the Range: Recipes and Stories from An Unlikely Life on a Farm,https://www.goodreads.com/book/show/28260495-molly-on-the-range
Sundays at Moosewood Restaurant,https://www.goodreads.com/book/show/198177.Sundays_at_Moosewood_Restaurant
Dinner: Changing the Game: A Cookbook,https://www.goodreads.com/book/show/30688016-dinner
Feast: Food to Celebrate Life,https://www.goodreads.com/book/show/39539.Feast
Love Real Food: More Than 100 Feel-Good Vegetarian Favorites to Delight the Senses and Nourish the Body,https://www.goodreads.com/book/show/31451086-love-real-food
"Forks Over Knives—The Cookbook: Over 300 Simple and Delicious Plant-Based Recipes to Help You Lose Weight, Be Healthier, and Feel Better Every Day",https://www.goodreads.com/book/show/14556629-forks-over-knives-the-cookbook
An Everlasting Meal: Cooking with Economy and Grace,https://www.goodreads.com/book/show/11300085-an-everlasting-meal
The Zuni Cafe Cookbook: A Compendium of Recipes and Cooking Lessons from San Francisco's Beloved Restaurant,https://www.goodreads.com/book/show/152723.The_Zuni_Cafe_Cookbook
Zaitoun: Recipes from the Palestinian Kitchen,https://www.goodreads.com/book/show/40180121-zaitoun
Flour: Spectacular Recipes from Boston’s Flour Bakery + Cafe,https://www.goodreads.com/book/show/8190925-flour
"Magnolia Table, Volume 2: A Collection of Recipes for Gathering",https://www.goodreads.com/book/show/48733177-magnolia-table-volume-2
Jamie's Italy,https://www.goodreads.com/book/show/8930.Jamie_s_Italy
"Make the Bread, Buy the Butter: What You Should and Shouldn't Cook from Scratch - Over 120 Recipes for the Best Homemade Foods",https://www.goodreads.com/book/show/11510733-make-the-bread-buy-the-butter
Bouchon Bakery (The Thomas Keller Library),https://www.goodreads.com/book/show/14358638-bouchon-bakery
The New Basics Cookbook,https://www.goodreads.com/book/show/232888.The_New_Basics_Cookbook
The Gourmet Cookbook: More than 1000 recipes,https://www.goodreads.com/book/show/53617.The_Gourmet_Cookbook
My Kitchen Year: 136 Recipes That Saved My Life,https://www.goodreads.com/book/show/24388414-my-kitchen-year
Super Natural Cooking: Five Delicious Ways to Incorporate Whole and Natural Foods into Your Cooking,https://www.goodreads.com/book/show/205997.Super_Natural_Cooking
"Small Victories: Recipes, Advice + Hundreds of Ideas for Home Cooking Triumphs",https://www.goodreads.com/book/show/28645653-small-victories
The Essential New York Times Cookbook: Classic Recipes for a New Century,https://www.goodreads.com/book/show/8101270-the-essential-new-york-times-cookbook
"The Pioneer Woman Cooks: Come and Get It! Simple, Scrumptious Recipes for Crazy Busy Lives",https://www.goodreads.com/book/show/34016988-the-pioneer-woman-cooks
Moosewood Restaurant Low-Fat Favorites: Flavorful Recipes for Healthful Meals,https://www.goodreads.com/book/show/198176.Moosewood_Restaurant_Low_Fat_Favorites
"Milk Street: Tuesday Nights: More than 200 Simple Weeknight Suppers that Deliver Bold Flavor, Fast",https://www.goodreads.com/book/show/38496740-milk-street
Antoni in the Kitchen,https://www.goodreads.com/book/show/39977443-antoni-in-the-kitchen
Slow Cooker Revolution,https://www.goodreads.com/book/show/10246097-slow-cooker-revolution
"Sheet Pan Suppers: 120 Recipes for Simple, Surprising, Hands-Off Meals Straight from the Oven",https://www.goodreads.com/book/show/20605489-sheet-pan-suppers
Vegan Richa's Indian Kitchen: Traditional and Creative Recipes for the Home Cook,https://www.goodreads.com/book/show/23258002-vegan-richa-s-indian-kitchen
Snacking Cakes: Simple Treats for Anytime Cravings: A Baking Book,https://www.goodreads.com/book/show/51152421-snacking-cakes
EveryDayCook,https://www.goodreads.com/book/show/28503835-everydaycook
"Skinnytaste One and Done: 140 No-Fuss Dinners for Your Instant Pot®, Slow Cooker, Air Fryer, Sheet Pan, Skillet, Dutch Oven, and More",https://www.goodreads.com/book/show/38121211-skinnytaste-one-and-done
Ruhlman's Twenty: The Ideas and Techniques that Will Make You a Better Cook,https://www.goodreads.com/book/show/11972889-ruhlman-s-twenty
"Hello, Cupcake",https://www.goodreads.com/book/show/2324124.Hello_Cupcake
"The Flavour Thesaurus: Pairings, Recipes and Ideas for the Creative Cook",https://www.goodreads.com/book/show/8487890-the-flavour-thesaurus
"Nigella Bites: From Family Meals to Elegant Dinners: Easy, Delectable Recipes for Any Occasion",https://www.goodreads.com/book/show/38549.Nigella_Bites
The Art of Fermentation: An in-Depth Exploration of Essential Concepts and Processes from Around the World,https://www.goodreads.com/book/show/13598307-the-art-of-fermentation
Vegan Cookies Invade Your Cookie Jar: 100 Dairy-Free Recipes for Everyone's Favorite Treats,https://www.goodreads.com/book/show/6364402-vegan-cookies-invade-your-cookie-jar
Moosewood Restaurant Cooks at Home: Fast and Easy Recipes for Any Day,https://www.goodreads.com/book/show/198175.Moosewood_Restaurant_Cooks_at_Home
The Taste of Country Cooking,https://www.goodreads.com/book/show/346029.The_Taste_of_Country_Cooking
Martha Stewart's Baking Handbook,https://www.goodreads.com/book/show/135875.Martha_Stewart_s_Baking_Handbook
The Pie and Pastry Bible,https://www.goodreads.com/book/show/101402.The_Pie_and_Pastry_Bible
Practical Paleo: A Customized Approach to Health and a Whole-Foods Lifestyle,https://www.goodreads.com/book/show/13586810-practical-paleo
"Baking with Julia: Sift, Knead, Flute, Flour, and Savor...",https://www.goodreads.com/book/show/184649.Baking_with_Julia
Outlander Kitchen: The Official Outlander Companion Cookbook,https://www.goodreads.com/book/show/26832930-outlander-kitchen
Dinner: A Love Story: It All Begins at the Family Table,https://www.goodreads.com/book/show/13043698-dinner
Everyday Pasta,https://www.goodreads.com/book/show/1193.Everyday_Pasta
Zahav: A World of Israeli Cooking,https://www.goodreads.com/book/show/23719433-zahav
Well Fed: Paleo Recipes for People Who Love to Eat,https://www.goodreads.com/book/show/13244078-well-fed
Jamie's 30-Minute Meals,https://www.goodreads.com/book/show/9047584-jamie-s-30-minute-meals
Vegan Brunch: Homestyle Recipes Worth Waking Up For—From Asparagus Omelets to Pumpkin Pancakes,https://www.goodreads.com/book/show/4052888-vegan-brunch
"Vegan Soul Kitchen: Fresh, Healthy, and Creative African-American Cuisine",https://www.goodreads.com/book/show/6062739-vegan-soul-kitchen
Martha Stewart's Cupcakes: 175 Inspired Ideas for Everyone's Favorite Treat: A Baking Book,https://www.goodreads.com/book/show/5103512-martha-stewart-s-cupcakes
Not Your Mother's Slow Cooker Cookbook,https://www.goodreads.com/book/show/10416.Not_Your_Mother_s_Slow_Cooker_Cookbook
Let's Make Ramen!: A Comic Book Cookbook,https://www.goodreads.com/book/show/42583941-let-s-make-ramen
Cook Like a Pro: Recipes and Tips for Home Cooks,https://www.goodreads.com/book/show/40006421-cook-like-a-pro
Good Eats: The Early Years,https://www.goodreads.com/book/show/6567682-good-eats
Chez Panisse Vegetables,https://www.goodreads.com/book/show/152706.Chez_Panisse_Vegetables
Good and Cheap: Eat Well on $4/Day,https://www.goodreads.com/book/show/22929168-good-and-cheap
Against All Grain: Delectable Paleo Recipes to Eat Well  Feel Great,https://www.goodreads.com/book/show/17415999-against-all-grain
"The Kind Diet: A Simple Guide to Feeling Great, Losing Weight, and Saving the Planet",https://www.goodreads.com/book/show/6780824-the-kind-diet
Cook Korean!: A Comic Book with Recipes [A Cookbook],https://www.goodreads.com/book/show/27209316-cook-korean
The Korean Vegan Cookbook: Reflections and Recipes from Omma's Kitchen,https://www.goodreads.com/book/show/56987996-the-korean-vegan-cookbook
The Lady & Sons Savannah Country Cookbook,https://www.goodreads.com/book/show/67657.The_Lady_Sons_Savannah_Country_Cookbook
The Forest Feast: Simple Vegetarian Recipes from My Cabin in the Woods,https://www.goodreads.com/book/show/18405511-the-forest-feast
The Cake Mix Doctor,https://www.goodreads.com/book/show/402017.The_Cake_Mix_Doctor
A Homemade Life: Stories and Recipes from My Kitchen Table,https://www.goodreads.com/book/show/3090282-a-homemade-life
Nigella Kitchen: Recipes from the Heart of the Home,https://www.goodreads.com/book/show/8433784-nigella-kitchen
The Back in the Day Bakery Cookbook: More Than 100 Recipes From the Best Little Bakery In the South,https://www.goodreads.com/book/show/13506703-the-back-in-the-day-bakery-cookbook
"Cool Beans: The Ultimate Guide to Cooking with the World's Most Versatile Plant-Based Protein, with 125 Recipes",https://www.goodreads.com/book/show/45754812-cool-beans
Cooking for Jeffrey: A Barefoot Contessa Cookbook,https://www.goodreads.com/book/show/28813966-cooking-for-jeffrey
Food in Jars: Preserving in Small Batches Year-Round,https://www.goodreads.com/book/show/13237773-food-in-jars
I'm Just Here for More Food: Food x Mixing + Heat = Baking,https://www.goodreads.com/book/show/101247.I_m_Just_Here_for_More_Food
Tequila Mockingbird: Cocktails with a Literary Twist,https://www.goodreads.com/book/show/15843172-tequila-mockingbird
"Wild Fermentation: The Flavor, Nutrition, and Craft of Live-Culture Foods",https://www.goodreads.com/book/show/109800.Wild_Fermentation
Falastin: A Cookbook,https://www.goodreads.com/book/show/51046553-falastin
Persiana: Recipes from the Middle East & Beyond,https://www.goodreads.com/book/show/21230950-persiana
"Anthony Bourdain's Les Halles Cookbook: Strategies, Recipes, and Techniques of Classic Bistro Cooking",https://www.goodreads.com/book/show/40137.Anthony_Bourdain_s_Les_Halles_Cookbook
Tender: Volume I: A Cook and His Vegetable Patch,https://www.goodreads.com/book/show/6788489-tender
The Naked Chef,https://www.goodreads.com/book/show/348695.The_Naked_Chef
The Little Paris Kitchen,https://www.goodreads.com/book/show/13614462-the-little-paris-kitchen
"It's All Good: Delicious, Easy Recipes That Will Make You Look Good and Feel Great",https://www.goodreads.com/book/show/16131211-it-s-all-good
"Pok Pok: Food and Stories from the Streets, Homes and Roadside Restaurants of Thailand",https://www.goodreads.com/book/show/17316521-pok-pok
The Taste of Home Cookbook,https://www.goodreads.com/book/show/3885.The_Taste_of_Home_Cookbook
"100 Days of Real Food: How We Did It, What We Learned, and 100 Easy, Wholesome Recipes Your Family Will Love",https://www.goodreads.com/book/show/18090093-100-days-of-real-food
