Title,URL
"The Complete Mediterranean Cookbook: 500 Vibrant, Kitchen-Tested Recipes for Living and Eating Well Every Day",https://www.goodreads.com/book/show/29902617-the-complete-mediterranean-cookbook
The Professional Chef,https://www.goodreads.com/book/show/306235.The_Professional_Chef
How to Cook Everything: The Basics: Simple Recipes Anyone Can Cook,https://www.goodreads.com/book/show/2603.How_to_Cook_Everything
Dorie's Cookies,https://www.goodreads.com/book/show/28560925-dorie-s-cookies
A Feast of Ice and Fire: The Official Companion Cookbook,https://www.goodreads.com/book/show/13329738-a-feast-of-ice-and-fire
The How Not to Die Cookbook,https://www.goodreads.com/book/show/33898876-the-how-not-to-die-cookbook
How It All Vegan!: Irresistible Recipes for an Animal-Free Diet,https://www.goodreads.com/book/show/48309.How_It_All_Vegan_
Mexican Everyday,https://www.goodreads.com/book/show/158463.Mexican_Everyday
"My Father's Daughter: Delicious, Easy Recipes Celebrating Family  Togetherness",https://www.goodreads.com/book/show/9443977-my-father-s-daughter
Forever Summer,https://www.goodreads.com/book/show/39543.Forever_Summer
Made in India: Recipes from an Indian Family Kitchen,https://www.goodreads.com/book/show/23848312-made-in-india
The Sioux Chef's Indigenous Kitchen,https://www.goodreads.com/book/show/34448042-the-sioux-chef-s-indigenous-kitchen
The Homemade Vegan Pantry: The Art of Making Your Own Staples,https://www.goodreads.com/book/show/23256202-the-homemade-vegan-pantry
Martha Stewart's Cooking School: Lessons and Recipes for the Home Cook: A Cookbook,https://www.goodreads.com/book/show/3030805-martha-stewart-s-cooking-school
"Whiskey in a Teacup: What Growing Up in the South Taught Me About Life, Love, and Baking Biscuits",https://www.goodreads.com/book/show/40009804-whiskey-in-a-teacup
Foundations of Flavor: The Noma Guide to Fermentation,https://www.goodreads.com/book/show/37590384-foundations-of-flavor
Baked: New Frontiers in Baking,https://www.goodreads.com/book/show/3328432-baked
Binging with Babish: 100 Recipes Recreated from Your Favorite Movies and TV Shows,https://www.goodreads.com/book/show/43261151-binging-with-babish
Thug Kitchen 101: Fast as F*ck,https://www.goodreads.com/book/show/30820811-thug-kitchen-101
"Arabesque: A Taste of Morocco, Turkey, and Lebanon",https://www.goodreads.com/book/show/452254.Arabesque
Maangchi's Real Korean Cooking,https://www.goodreads.com/book/show/22749715-maangchi-s-real-korean-cooking
Authentic Mexican: Regional Cooking from the Heart of Mexico,https://www.goodreads.com/book/show/158472.Authentic_Mexican
The Cook's Illustrated Cookbook,https://www.goodreads.com/book/show/12470265-the-cook-s-illustrated-cookbook
"Canning for a New Generation: Bold, Fresh Flavors for the Modern Pantry",https://www.goodreads.com/book/show/8527185-canning-for-a-new-generation
Midnight Chicken: & Other Recipes Worth Living For,https://www.goodreads.com/book/show/37805223-midnight-chicken
The Little House Cookbook: Frontier Foods from Laura Ingalls Wilder's Classic Stories,https://www.goodreads.com/book/show/8298.The_Little_House_Cookbook
Betty Crocker's Cookbook,https://www.goodreads.com/book/show/1127996.Betty_Crocker_s_Cookbook
Giada's Kitchen: New Favorites from Everyday Italian,https://www.goodreads.com/book/show/2596537-giada-s-kitchen
Happy Days With The Naked Chef,https://www.goodreads.com/book/show/531445.Happy_Days_With_The_Naked_Chef
River Cottage Veg Every Day!,https://www.goodreads.com/book/show/12576078-river-cottage-veg-every-day
Joy the Baker Cookbook: 100 Simple and Comforting Recipes,https://www.goodreads.com/book/show/12986251-joy-the-baker-cookbook
Vegan Planet: 400 Irresistible Recipes with Fantastic Flavors from Home and Around the World,https://www.goodreads.com/book/show/48308.Vegan_Planet
Lucky Peach Presents 101 Easy Asian Recipes,https://www.goodreads.com/book/show/24388391-lucky-peach-presents-101-easy-asian-recipes
"Half Baked Harvest Every Day: Recipes for Balanced, Flexible, Feel-Good Meals",https://www.goodreads.com/book/show/57414578-half-baked-harvest-every-day
Mooncakes and Milk Bread: Sweet and   Savory Recipes Inspired by Chinese Bakeries,https://www.goodreads.com/book/show/55918609-mooncakes-and-milk-bread
Land of Plenty: A Treasury of Authentic Sichuan Cooking,https://www.goodreads.com/book/show/94561.Land_of_Plenty
"CookWise: The Hows & Whys of Successful Cooking, The Secrets of Cooking Revealed",https://www.goodreads.com/book/show/76875.CookWise
How to Cook Without a Book: Recipes and Techniques Every Cook Should Know by Heart,https://www.goodreads.com/book/show/236011.How_to_Cook_Without_a_Book
The Baking Bible,https://www.goodreads.com/book/show/22058985-the-baking-bible
Milk Bar Life: Recipes & Stories,https://www.goodreads.com/book/show/22716424-milk-bar-life
"Japanese Soul Cooking: Ramen, Tonkatsu, Tempura, and More from the Streets and Kitchens of Tokyo and Beyond",https://www.goodreads.com/book/show/17262625-japanese-soul-cooking
"My Bread: The Revolutionary No-Work, No-Knead Method",https://www.goodreads.com/book/show/6540114-my-bread
The Joy of Vegan Baking: The Compassionate Cooks' Traditional Treats and Sinful Sweets,https://www.goodreads.com/book/show/805500.The_Joy_of_Vegan_Baking
30-Minute Meals 2,https://www.goodreads.com/book/show/71805.30_Minute_Meals_2
Food Matters: A Guide to Conscious Eating with More Than 75 Recipes,https://www.goodreads.com/book/show/3698601-food-matters
Weight Watchers New Complete Cookbook,https://www.goodreads.com/book/show/3889.Weight_Watchers_New_Complete_Cookbook
Sauces: Classical and Contemporary Sauce Making,https://www.goodreads.com/book/show/86405.Sauces
Mostly Plants: 101 Delicious Flexitarian Recipes from the Pollan Family,https://www.goodreads.com/book/show/40864247-mostly-plants
Mamushka: Recipes from Ukraine and Eastern Europe,https://www.goodreads.com/book/show/25152055-mamushka
"The Vegetable Butcher: How to Select, Prep, Slice, Dice, and Masterfully Cook Vegetables from Artichokes to Zucchini",https://www.goodreads.com/book/show/25810693-the-vegetable-butcher
"Nigella Christmas: Food, Family, Friends, Festivities",https://www.goodreads.com/book/show/5055763-nigella-christmas
Ben & Jerry's Homemade Ice Cream & Dessert Book,https://www.goodreads.com/book/show/198781.Ben_Jerry_s_Homemade_Ice_Cream_Dessert_Book
"Fresh India: 130 Quick, Easy and Delicious Vegetarian Recipes for Every Day",https://www.goodreads.com/book/show/29776979-fresh-india
"But I Could Never Go Vegan!: 125 Recipes That Prove You Can Live Without Cheese, It's Not All Rabbit Food, and Your Friends Will Still Come Over for Dinner",https://www.goodreads.com/book/show/20862694-but-i-could-never-go-vegan
The Naked Chef Takes Off,https://www.goodreads.com/book/show/155476.The_Naked_Chef_Takes_Off
Jamie's Dinners: The Essential Family Cookbook,https://www.goodreads.com/book/show/8931.Jamie_s_Dinners
30-Minute Meals,https://www.goodreads.com/book/show/71806.30_Minute_Meals
The Food You Crave: Luscious Recipes for a Healthy Life,https://www.goodreads.com/book/show/1840349.The_Food_You_Crave
That Sounds So Good: 100 Real-Life Recipes for Every Day of the Week: A Cookbook,https://www.goodreads.com/book/show/56637930-that-sounds-so-good
"To Asia, with Love: Everyday Asian Recipes and Stories from the Heart",https://www.goodreads.com/book/show/55381410-to-asia-with-love
Bouchon,https://www.goodreads.com/book/show/79503.Bouchon
Baking Illustrated: A Best Recipe Classic,https://www.goodreads.com/book/show/32158.Baking_Illustrated
Simply Julia: 110 Easy Recipes for Healthy Comfort Food,https://www.goodreads.com/book/show/53441180-simply-julia
Moosewood Restaurant New Classics: 350 Recipes for Homestyle Favorites and Everyday Feasts,https://www.goodreads.com/book/show/198178.Moosewood_Restaurant_New_Classics
Korean American: Food that Tastes Like Home,https://www.goodreads.com/book/show/58284098-korean-american
Smoke and Pickles: Recipes and Stories from a New Southern Kitchen,https://www.goodreads.com/book/show/15953243-smoke-and-pickles
The Happy Herbivore Cookbook: Over 175 Delicious Fat-Free and Low-Fat Vegan Recipes,https://www.goodreads.com/book/show/7913713-the-happy-herbivore-cookbook
"Asian Dumplings: Mastering Gyoza, Spring Rolls, Samosas, and More",https://www.goodreads.com/book/show/6579880-asian-dumplings
Ruffage: A Practical Guide to Vegetables,https://www.goodreads.com/book/show/41423210-ruffage
"Danielle Walker's Against All Grain: Meals Made Simple: Gluten-Free, Dairy-Free, and Paleo Recipes to Make Anytime",https://www.goodreads.com/book/show/20945825-danielle-walker-s-against-all-grain
Betty Crocker's Cooky Book,https://www.goodreads.com/book/show/129664.Betty_Crocker_s_Cooky_Book
Larousse Gastronomique: The World's Greatest Culinary Encyclopedia,https://www.goodreads.com/book/show/815612.Larousse_Gastronomique
The Homesick Texan Cookbook,https://www.goodreads.com/book/show/10792142-the-homesick-texan-cookbook
Hot for Food Vegan Comfort Classics: 101 Recipes to Feed Your Face: A Cookbook,https://www.goodreads.com/book/show/35306053-hot-for-food-vegan-comfort-classics
"Taste of Persia: A Cook's Travels Through Armenia, Azerbaijan, Georgia, Iran, and Kurdistan",https://www.goodreads.com/book/show/28440201-taste-of-persia
Thug Kitchen Party Grub: For Social Motherf*ckers (Thug Kitchen Cookbooks),https://www.goodreads.com/book/show/24615953-thug-kitchen-party-grub
Molto Italiano: 327 Simple Italian Recipes to Cook at Home,https://www.goodreads.com/book/show/139217.Molto_Italiano
More-With-Less Cookbook,https://www.goodreads.com/book/show/925697.More_With_Less_Cookbook
King Arthur Flour Whole Grain Baking: Delicious Recipes Using Nutritious Whole Grains,https://www.goodreads.com/book/show/10568.King_Arthur_Flour_Whole_Grain_Baking
"Rachael Ray Express Lane Meals: What to Keep on Hand, What to Buy Fresh for the Easiest-Ever 30-Minute Meals",https://www.goodreads.com/book/show/71803.Rachael_Ray_Express_Lane_Meals
"Cooking for Geeks: Real Science, Great Cooks, and Good Food",https://www.goodreads.com/book/show/25770528-cooking-for-geeks
Mexico One Plate At A Time,https://www.goodreads.com/book/show/383480.Mexico_One_Plate_At_A_Time
The Flavor Equation: The Science of Great Cooking Explained in More Than 100 Essential Recipes,https://www.goodreads.com/book/show/50998820-the-flavor-equation
It's All Easy: Delicious Weekday Recipes for the Super-Busy Home Cook,https://www.goodreads.com/book/show/26031228-it-s-all-easy
Baking Chez Moi: Recipes from My Paris Home to Your Home Anywhere,https://www.goodreads.com/book/show/20256555-baking-chez-moi
"Charcuterie: The Craft of Salting, Smoking, and Curing",https://www.goodreads.com/book/show/164427.Charcuterie
The Weekday Vegetarians: 100 Recipes and a Real-Life Plan for Eating Less Meat: A Cookbook,https://www.goodreads.com/book/show/56212890-the-weekday-vegetarians
"Plant-Based on a Budget: Delicious Vegan Recipes for Under $30 a Week, in Less Than 30 Minutes a Meal",https://www.goodreads.com/book/show/41948849-plant-based-on-a-budget
Hot Sour Salty Sweet: A Culinary Journey Through Southeast Asia,https://www.goodreads.com/book/show/97658.Hot_Sour_Salty_Sweet
"Whole Food Cooking Every Day: Transform the Way You Eat with 250 Vegetarian Recipes Free of Gluten, Dairy, and Refined Sugar",https://www.goodreads.com/book/show/43069948-whole-food-cooking-every-day
