Title,URL
"The Surgeon (Rizzoli & Isles, #1)",https://www.goodreads.com/book/show/32263.The_Surgeon
"The Lincoln Lawyer (The Lincoln Lawyer, #1; Harry Bosch Universe, #15)",https://www.goodreads.com/book/show/40612032-the-lincoln-lawyer
"The Silence of the Lambs  (Hannibal Lecter, #2)",https://www.goodreads.com/book/show/23807.The_Silence_of_the_Lambs
"Jackaby (Jackaby, #1)",https://www.goodreads.com/book/show/20312462-jackaby
Home Before Dark,https://www.goodreads.com/book/show/50833559-home-before-dark
"Hickory Dickory Dock (Hercule Poirot, #27)",https://www.goodreads.com/book/show/31299.Hickory_Dickory_Dock
"The Cold Dish (Walt Longmire, #1)",https://www.goodreads.com/book/show/109901.The_Cold_Dish
"A Time to Kill (Jake Brigance, #1)",https://www.goodreads.com/book/show/32542.A_Time_to_Kill
Dark Matter,https://www.goodreads.com/book/show/27833670-dark-matter
"Cover Her Face (Adam Dalgliesh, #1)",https://www.goodreads.com/book/show/3832.Cover_Her_Face
Mystic River,https://www.goodreads.com/book/show/21671.Mystic_River
The Forgotten Garden,https://www.goodreads.com/book/show/3407877-the-forgotten-garden
"Mrs. McGinty's Dead (Hercule Poirot, #25)",https://www.goodreads.com/book/show/121622.Mrs_McGinty_s_Dead
The Lying Game,https://www.goodreads.com/book/show/32895291-the-lying-game
"Troubled Blood (Cormoran Strike, #5)",https://www.goodreads.com/book/show/51807232-troubled-blood
The Thin Man,https://www.goodreads.com/book/show/80616.The_Thin_Man
"Raven Black (Shetland Island, #1)",https://www.goodreads.com/book/show/644655.Raven_Black
"Dead Man's Folly (Hercule Poirot, #28)",https://www.goodreads.com/book/show/16329.Dead_Man_s_Folly
"E is for Evidence (Kinsey Millhone, #5)",https://www.goodreads.com/book/show/64860.E_is_for_Evidence
The Historian,https://www.goodreads.com/book/show/30236962-the-historian
"Mistress of the Art of Death (Mistress of the Art of Death, #1)",https://www.goodreads.com/book/show/86643.Mistress_of_the_Art_of_Death
"Third Girl (Hercule Poirot, #31)",https://www.goodreads.com/book/show/16332.Third_Girl
"Grave Sight (Harper Connelly, #1)",https://www.goodreads.com/book/show/58077.Grave_Sight
"Unnatural Death (Lord Peter Wimsey, #3)",https://www.goodreads.com/book/show/192892.Unnatural_Death
"Explosive Eighteen (Stephanie Plum, #18)",https://www.goodreads.com/book/show/11746513-explosive-eighteen
The Outsider,https://www.goodreads.com/book/show/36124936-the-outsider
"The Box in the Woods (Truly Devious, #4)",https://www.goodreads.com/book/show/52716736-the-box-in-the-woods
"The Final Gambit (The Inheritance Games, #3)",https://www.goodreads.com/book/show/58658940-the-final-gambit
"The Quiche of Death (Agatha Raisin, #1)",https://www.goodreads.com/book/show/139176.The_Quiche_of_Death
"The Spellman Files (The Spellmans, #1)",https://www.goodreads.com/book/show/129117.The_Spellman_Files
"F is for Fugitive (Kinsey Millhone, #6)",https://www.goodreads.com/book/show/169211.F_is_for_Fugitive
"Immortal in Death (In Death, #3)",https://www.goodreads.com/book/show/238126.Immortal_in_Death
"Pretty Little Liars (Pretty Little Liars, #1)",https://www.goodreads.com/book/show/162085.Pretty_Little_Liars
Why Didn't They Ask Evans?,https://www.goodreads.com/book/show/102303.Why_Didn_t_They_Ask_Evans_
"My Sister, the Serial Killer",https://www.goodreads.com/book/show/38819868-my-sister-the-serial-killer
Endless Night,https://www.goodreads.com/book/show/16366.Endless_Night
"A Letter of Mary (Mary Russell and Sherlock Holmes, #3)",https://www.goodreads.com/book/show/93938.A_Letter_of_Mary
"A Better Man (Chief Inspector Armand Gamache, #15)",https://www.goodreads.com/book/show/44034500-a-better-man
"Faceless Killers (Kurt Wallander, #1)",https://www.goodreads.com/book/show/935308.Faceless_Killers
"The Nine Tailors (Lord Peter Wimsey, #9)",https://www.goodreads.com/book/show/126675.The_Nine_Tailors
Tell No One,https://www.goodreads.com/book/show/43933.Tell_No_One
