Title,URL
And Then There Were None,https://www.goodreads.com/book/show/16299.And_Then_There_Were_None
"Murder on the Orient Express (Hercule Poirot, #9)",https://www.goodreads.com/book/show/853510.Murder_on_the_Orient_Express
"The Girl with the Dragon Tattoo (Millennium, #1)",https://www.goodreads.com/book/show/2429135.The_Girl_with_the_Dragon_Tattoo
Gone Girl,https://www.goodreads.com/book/show/19288043-gone-girl
The Girl on the Train,https://www.goodreads.com/book/show/22557272-the-girl-on-the-train
"The Da Vinci Code (Robert Langdon, #2)",https://www.goodreads.com/book/show/968.The_Da_Vinci_Code
"The Mysterious Affair at Styles (Hercule Poirot, #1)",https://www.goodreads.com/book/show/52843028-the-mysterious-affair-at-styles
"The Cuckoo's Calling (Cormoran Strike, #1)",https://www.goodreads.com/book/show/16160797-the-cuckoo-s-calling
"Angels & Demons (Robert Langdon, #1)",https://www.goodreads.com/book/show/960.Angels_Demons
"One of Us Is Lying (One of Us is Lying, #1)",https://www.goodreads.com/book/show/58679358-one-of-us-is-lying
"The Murder of Roger Ackroyd (Hercule Poirot, #3)",https://www.goodreads.com/book/show/16328.The_Murder_of_Roger_Ackroyd
"In the Woods (Dublin Murder Squad, #1)",https://www.goodreads.com/book/show/2459785.In_the_Woods
The Seven Deaths of Evelyn Hardcastle,https://www.goodreads.com/book/show/62229748-the-seven-deaths-of-evelyn-hardcastle
"A Study in Scarlet (Sherlock Holmes, #1)",https://www.goodreads.com/book/show/102868.A_Study_in_Scarlet
The Silent Patient,https://www.goodreads.com/book/show/40097951-the-silent-patient
"The Girl Who Played with Fire (Millennium, #2)",https://www.goodreads.com/book/show/5060378-the-girl-who-played-with-fire
"Death on the Nile (Hercule Poirot, #16)",https://www.goodreads.com/book/show/131359.Death_on_the_Nile
"The Hound of the Baskervilles (Sherlock Holmes, #5)",https://www.goodreads.com/book/show/8921.The_Hound_of_the_Baskervilles
"Still Life (Chief Inspector Armand Gamache, #1)",https://www.goodreads.com/book/show/338691.Still_Life
"The Sweetness at the Bottom of the Pie (Flavia de Luce, #1)",https://www.goodreads.com/book/show/40605285-the-sweetness-at-the-bottom-of-the-pie
"A Good Girl's Guide to Murder (A Good Girl's Guide to Murder, #1)",https://www.goodreads.com/book/show/40916679-a-good-girl-s-guide-to-murder
The Guest List,https://www.goodreads.com/book/show/51933429-the-guest-list
Sharp Objects,https://www.goodreads.com/book/show/18045891-sharp-objects
"The Girl Who Kicked the Hornet's Nest (Millennium, #3)",https://www.goodreads.com/book/show/6892870-the-girl-who-kicked-the-hornet-s-nest
"The Adventures of Sherlock Holmes (Sherlock Holmes, #3)",https://www.goodreads.com/book/show/3590.The_Adventures_of_Sherlock_Holmes
"The Inheritance Games (The Inheritance Games, #1)",https://www.goodreads.com/book/show/52439531-the-inheritance-games
"One for the Money (Stephanie Plum, #1)",https://www.goodreads.com/book/show/6853.One_for_the_Money
"Truly Devious (Truly Devious, #1)",https://www.goodreads.com/book/show/29589074-truly-devious
Murder at the Vicarage,https://www.goodreads.com/book/show/16331.Murder_at_the_Vicarage
"The Silkworm (Cormoran Strike, #2)",https://www.goodreads.com/book/show/18214414-the-silkworm
Dark Places,https://www.goodreads.com/book/show/5886881-dark-places
"The A.B.C. Murders (Hercule Poirot, #12)",https://www.goodreads.com/book/show/16322.The_A_B_C_Murders
Where the Crawdads Sing,https://www.goodreads.com/book/show/36809135-where-the-crawdads-sing
Rebecca,https://www.goodreads.com/book/show/17899948-rebecca
We Were Liars,https://www.goodreads.com/book/show/16143347-we-were-liars
"The Thursday Murder Club (Thursday Murder Club, #1)",https://www.goodreads.com/book/show/46000520-the-thursday-murder-club
The Woman in Cabin 10,https://www.goodreads.com/book/show/28187230-the-woman-in-cabin-10
The Westing Game,https://www.goodreads.com/book/show/902.The_Westing_Game
"The No. 1 Ladies' Detective Agency (No. 1 Ladies' Detective Agency, #1)",https://www.goodreads.com/book/show/7061.The_No_1_Ladies_Detective_Agency
"The Lost Symbol (Robert Langdon, #3)",https://www.goodreads.com/book/show/6411961-the-lost-symbol
"The Shadow of the Wind (The Cemetery of Forgotten Books, #1)",https://www.goodreads.com/book/show/1232.The_Shadow_of_the_Wind
The Woman in the Window,https://www.goodreads.com/book/show/40389527-the-woman-in-the-window
The Curious Incident of the Dog in the Night-Time,https://www.goodreads.com/book/show/1618.The_Curious_Incident_of_the_Dog_in_the_Night_Time
"Magpie Murders (Susan Ryeland, #1)",https://www.goodreads.com/book/show/32075854-magpie-murders
"Maisie Dobbs (Maisie Dobbs, #1)",https://www.goodreads.com/book/show/462033.Maisie_Dobbs
"The Sign of Four (Sherlock Holmes, #2)",https://www.goodreads.com/book/show/608474.The_Sign_of_Four
The Secret History,https://www.goodreads.com/book/show/29044.The_Secret_History
"Career of Evil (Cormoran Strike, #3)",https://www.goodreads.com/book/show/40611999-career-of-evil
"The Beekeeper's Apprentice (Mary Russell and Sherlock Holmes, #1)",https://www.goodreads.com/book/show/91661.The_Beekeeper_s_Apprentice
The Body in the Library,https://www.goodreads.com/book/show/16319.The_Body_in_the_Library
The Maid,https://www.goodreads.com/book/show/55196813-the-maid
"A Fatal Grace (Chief Inspector Armand Gamache, #2)",https://www.goodreads.com/book/show/352921.A_Fatal_Grace
"Crocodile on the Sandbank (Amelia Peabody, #1)",https://www.goodreads.com/book/show/40881649-crocodile-on-the-sandbank
"A is for Alibi (Kinsey Millhone, #1)",https://www.goodreads.com/book/show/64863.A_is_for_Alibi
The Lovely Bones,https://www.goodreads.com/book/show/12232938-the-lovely-bones
The Thirteenth Tale,https://www.goodreads.com/book/show/40440.The_Thirteenth_Tale
"The Murder on the Links (Hercule Poirot, #2)",https://www.goodreads.com/book/show/51132354-the-murder-on-the-links
Big Little Lies,https://www.goodreads.com/book/show/33516773-big-little-lies
The Complete Sherlock Holmes,https://www.goodreads.com/book/show/188572.The_Complete_Sherlock_Holmes
"The Likeness (Dublin Murder Squad, #2)",https://www.goodreads.com/book/show/5941114-the-likeness
"The Dry (Aaron Falk, #1)",https://www.goodreads.com/book/show/27824826-the-dry
Verity,https://www.goodreads.com/book/show/59344312-verity
"Whose Body?  (Lord Peter Wimsey, #1)",https://www.goodreads.com/book/show/192893.Whose_Body_
"Inferno (Robert Langdon, #4)",https://www.goodreads.com/book/show/17212231-inferno
The Name of the Rose,https://www.goodreads.com/book/show/119073.The_Name_of_the_Rose
"Two for the Dough (Stephanie Plum, #2)",https://www.goodreads.com/book/show/6427.Two_for_the_Dough
"The Big Sleep (Philip Marlowe, #1)",https://www.goodreads.com/book/show/2052.The_Big_Sleep
If We Were Villains,https://www.goodreads.com/book/show/30319086-if-we-were-villains
The Last Thing He Told Me,https://www.goodreads.com/book/show/54981009-the-last-thing-he-told-me
"The Alienist (Dr. Laszlo Kreizler, #1)",https://www.goodreads.com/book/show/40024.The_Alienist
"The Weed That Strings the Hangman's Bag (Flavia de Luce, #2)",https://www.goodreads.com/book/show/6777616-the-weed-that-strings-the-hangman-s-bag
"The Cruelest Month (Chief Inspector Armand Gamache, #3)",https://www.goodreads.com/book/show/2277378.The_Cruelest_Month
"Storm Front (The Dresden Files, #1)",https://www.goodreads.com/book/show/47212.Storm_Front
"A Study in Charlotte (Charlotte Holmes, #1)",https://www.goodreads.com/book/show/23272028-a-study-in-charlotte
"Naked in Death (In Death, #1)",https://www.goodreads.com/book/show/479309.Naked_in_Death
The Maltese Falcon,https://www.goodreads.com/book/show/29999.The_Maltese_Falcon
A Murder Is Announced,https://www.goodreads.com/book/show/16298.A_Murder_Is_Announced
The Woman in White,https://www.goodreads.com/book/show/5890.The_Woman_in_White
"Three to Get Deadly (Stephanie Plum, #3)",https://www.goodreads.com/book/show/6854.Three_to_Get_Deadly
"Hercule Poirot's Christmas (Hercule Poirot, #18)",https://www.goodreads.com/book/show/16349.Hercule_Poirot_s_Christmas
Into the Water,https://www.goodreads.com/book/show/33151805-into-the-water
"Lethal White (Cormoran Strike, #4)",https://www.goodreads.com/book/show/42283287-lethal-white
"Peril at End House (Hercule Poirot, #7)",https://www.goodreads.com/book/show/16424.Peril_at_End_House
Sadie,https://www.goodreads.com/book/show/34810320-sadie
"A Curious Beginning (Veronica Speedwell, #1)",https://www.goodreads.com/book/show/28186322-a-curious-beginning
"Faithful Place (Dublin Murder Squad, #3)",https://www.goodreads.com/book/show/7093952-faithful-place
"The Secret of the Old Clock (Nancy Drew Mystery Stories, #1)",https://www.goodreads.com/book/show/32979.The_Secret_of_the_Old_Clock
"A Rule Against Murder (Chief Inspector Armand Gamache, #4)",https://www.goodreads.com/book/show/4201106-a-rule-against-murder
"The Secret Adversary (Tommy and Tuppence, #1)",https://www.goodreads.com/book/show/49596.The_Secret_Adversary
"Evil Under the Sun (Hercule Poirot, #21)",https://www.goodreads.com/book/show/16305.Evil_Under_the_Sun
"In a Dark, Dark Wood",https://www.goodreads.com/book/show/27834600-in-a-dark-dark-wood
"Good Girl, Bad Blood (A Good Girl's Guide to Murder, #2)",https://www.goodreads.com/book/show/51335759-good-girl-bad-blood
Then She Was Gone,https://www.goodreads.com/book/show/35297426-then-she-was-gone
The Death of Mrs. Westaway,https://www.goodreads.com/book/show/36373481-the-death-of-mrs-westaway
4:50 from Paddington,https://www.goodreads.com/book/show/140278.4
"The Vanishing Stair (Truly Devious, #2)",https://www.goodreads.com/book/show/39893545-the-vanishing-stair
The Turn of the Key,https://www.goodreads.com/book/show/42080142-the-turn-of-the-key
"Stalking Jack the Ripper (Stalking Jack the Ripper, #1)",https://www.goodreads.com/book/show/40727470-stalking-jack-the-ripper
"Four to Score (Stephanie Plum, #4)",https://www.goodreads.com/book/show/6422.Four_to_Score
"The Mystery of the Blue Train (Hercule Poirot, #5)",https://www.goodreads.com/book/show/16335.The_Mystery_of_the_Blue_Train
"One of Us Is Next (One of Us Is Lying, #2)",https://www.goodreads.com/book/show/44654627-one-of-us-is-next
"Hallowe'en Party (Hercule Poirot, #32)",https://www.goodreads.com/book/show/16307.Hallowe_en_Party
The Moonstone,https://www.goodreads.com/book/show/6138.The_Moonstone
Crooked House,https://www.goodreads.com/book/show/16315.Crooked_House
"The Brutal Telling (Chief Inspector Armand Gamache, #5)",https://www.goodreads.com/book/show/6449551-the-brutal-telling
"Cards on the Table (Hercule Poirot, #14)",https://www.goodreads.com/book/show/16297.Cards_on_the_Table
"High Five (Stephanie Plum, #5)",https://www.goodreads.com/book/show/6423.High_Five
The Paris Apartment,https://www.goodreads.com/book/show/58468990-the-paris-apartment
Death Comes to Pemberley,https://www.goodreads.com/book/show/12875355-death-comes-to-pemberley
"Hot Six (Stephanie Plum, #6)",https://www.goodreads.com/book/show/6858.Hot_Six
"A Red Herring Without Mustard (Flavia de Luce, #3)",https://www.goodreads.com/book/show/8517008-a-red-herring-without-mustard
"A Study in Scarlet Women (Lady Sherlock, #1)",https://www.goodreads.com/book/show/28588390-a-study-in-scarlet-women
"The Hawthorne Legacy (The Inheritance Games, #2)",https://www.goodreads.com/book/show/50531218-the-hawthorne-legacy
"Five Little Pigs (Hercule Poirot, #22)",https://www.goodreads.com/book/show/121648.Five_Little_Pigs
"Bury Your Dead (Chief Inspector Armand Gamache, #6)",https://www.goodreads.com/book/show/7945049-bury-your-dead
"The Beautiful Mystery (Chief Inspector Armand Gamache, #8)",https://www.goodreads.com/book/show/16045144-the-beautiful-mystery
Two Can Keep a Secret,https://www.goodreads.com/book/show/38225791-two-can-keep-a-secret
The Hunting Party,https://www.goodreads.com/book/show/37642030-the-hunting-party
"Murder in Mesopotamia (Hercule Poirot, #13)",https://www.goodreads.com/book/show/16360.Murder_in_Mesopotamia
"Case Histories (Jackson Brodie, #1)",https://www.goodreads.com/book/show/16243.Case_Histories
The Maidens,https://www.goodreads.com/book/show/45300567-the-maidens
"The Memoirs of Sherlock Holmes (Sherlock Holmes, #4)",https://www.goodreads.com/book/show/194373.The_Memoirs_of_Sherlock_Holmes
"Déjà Dead (Temperance Brennan, #1)",https://www.goodreads.com/book/show/231604.D_j_Dead
"The Big Four (Hercule Poirot, #4)",https://www.goodreads.com/book/show/16316.The_Big_Four
"Broken Harbor (Dublin Murder Squad, #4)",https://www.goodreads.com/book/show/16171207-broken-harbor
"Ninth House (Alex Stern, #1)",https://www.goodreads.com/book/show/43263680-ninth-house
"Appointment with Death (Hercule Poirot, #17)",https://www.goodreads.com/book/show/16363.Appointment_with_Death
"1st to Die (Women's Murder Club, #1)",https://www.goodreads.com/book/show/13137.1st_to_Die
"Seven Up (Stephanie Plum, #7)",https://www.goodreads.com/book/show/6424.Seven_Up
"A Trick of the Light (Chief Inspector Armand Gamache, #7)",https://www.goodreads.com/book/show/10680329-a-trick-of-the-light
"How the Light Gets In (Chief Inspector Armand Gamache, #9)",https://www.goodreads.com/book/show/17167084-how-the-light-gets-in
The Moving Finger,https://www.goodreads.com/book/show/16341.The_Moving_Finger
Before I Go to Sleep,https://www.goodreads.com/book/show/9736930-before-i-go-to-sleep
Shutter Island,https://www.goodreads.com/book/show/21686.Shutter_Island
"Along Came a Spider (Alex Cross, #1)",https://www.goodreads.com/book/show/13145.Along_Came_a_Spider
"The Hand on the Wall (Truly Devious, #3)",https://www.goodreads.com/book/show/45240918-the-hand-on-the-wall
The Sun Down Motel,https://www.goodreads.com/book/show/45885644-the-sun-down-motel
"Miss Peregrine's Home for Peculiar Children (Miss Peregrine's Peculiar Children, #1)",https://www.goodreads.com/book/show/9460487-miss-peregrine-s-home-for-peculiar-children
"Lord Edgware Dies (Hercule Poirot, #8)",https://www.goodreads.com/book/show/215492.Lord_Edgware_Dies
"Hard Eight (Stephanie Plum, #8)",https://www.goodreads.com/book/show/6425.Hard_Eight
"Death in the Clouds (Hercule Poirot, #11)",https://www.goodreads.com/book/show/16326.Death_in_the_Clouds
The Couple Next Door,https://www.goodreads.com/book/show/28815474-the-couple-next-door
"Poirot Investigates (Hercule Poirot, #1.5)",https://www.goodreads.com/book/show/57806251-poirot-investigates
"The Man in the Brown Suit (Colonel Race, #1)",https://www.goodreads.com/book/show/209194.The_Man_in_the_Brown_Suit
"The Word Is Murder (Hawthorne and Horowitz Mystery, #1)",https://www.goodreads.com/book/show/36204075-the-word-is-murder
"Mr. Penumbra's 24-Hour Bookstore (Mr. Penumbra's 24-Hour Bookstore, #1)",https://www.goodreads.com/book/show/13538873-mr-penumbra-s-24-hour-bookstore
"I Am Half-Sick of Shadows (Flavia de Luce, #4)",https://www.goodreads.com/book/show/33215762-i-am-half-sick-of-shadows
"The Secret Place (Dublin Murder Squad, #5)",https://www.goodreads.com/book/show/52263433-the-secret-place
"The Mirror Crack'd from Side to Side (Miss Marple, #8)",https://www.goodreads.com/book/show/16372.The_Mirror_Crack_d_from_Side_to_Side
"Postmortem (Kay Scarpetta, #1)",https://www.goodreads.com/book/show/6534.Postmortem
"To the Nines (Stephanie Plum, #9)",https://www.goodreads.com/book/show/40331.To_the_Nines
"The Family Upstairs (The Family Upstairs, #1)",https://www.goodreads.com/book/show/43822820-the-family-upstairs
"A Pocket Full of Rye  (Miss Marple, #7)",https://www.goodreads.com/book/show/834378.A_Pocket_Full_of_Rye
Night Film,https://www.goodreads.com/book/show/18770398-night-film
Deception Point,https://www.goodreads.com/book/show/976.Deception_Point
"The Eyre Affair (Thursday Next, #1)",https://www.goodreads.com/book/show/27003.The_Eyre_Affair
"The Man Who Died Twice (Thursday Murder Club, #2)",https://www.goodreads.com/book/show/55457493-the-man-who-died-twice
"Her Royal Spyness (Her Royal Spyness Mysteries, #1)",https://www.goodreads.com/book/show/383514.Her_Royal_Spyness
Mexican Gothic,https://www.goodreads.com/book/show/53152636-mexican-gothic
"Rivers of London (Rivers of London, #1)",https://www.goodreads.com/book/show/9317452-rivers-of-london
"Dead Until Dark (Sookie Stackhouse, #1)",https://www.goodreads.com/book/show/301082.Dead_Until_Dark
A Caribbean Mystery,https://www.goodreads.com/book/show/31300.A_Caribbean_Mystery
Sleeping Murder,https://www.goodreads.com/book/show/16300.Sleeping_Murder
"Cat Among the Pigeons (Hercule Poirot, #29)",https://www.goodreads.com/book/show/16342.Cat_Among_the_Pigeons
"Curtain (Hercule Poirot, #34)",https://www.goodreads.com/book/show/81903.Curtain
"Speaking from Among the Bones (Flavia de Luce, #5)",https://www.goodreads.com/book/show/13642963-speaking-from-among-the-bones
"Cocaine Blues (Phryne Fisher, #1)",https://www.goodreads.com/book/show/41022009-cocaine-blues
"Eleven on Top (Stephanie Plum, #11)",https://www.goodreads.com/book/show/11003.Eleven_on_Top
"Birds of a Feather (Maisie Dobbs, #2)",https://www.goodreads.com/book/show/83083.Birds_of_a_Feather
Digital Fortress,https://www.goodreads.com/book/show/11125.Digital_Fortress
"The Long Way Home (Chief Inspector Armand Gamache, #10)",https://www.goodreads.com/book/show/19561922-the-long-way-home
"Ten Big Ones (Stephanie Plum, #10)",https://www.goodreads.com/book/show/86663.Ten_Big_Ones
At Bertram's Hotel,https://www.goodreads.com/book/show/16333.At_Bertram_s_Hotel
"Killing Floor (Jack Reacher, #1)",https://www.goodreads.com/book/show/78129.Killing_Floor
"B is for Burglar (Kinsey Millhone, #2)",https://www.goodreads.com/book/show/64865.B_is_for_Burglar
The Cousins,https://www.goodreads.com/book/show/49757149-the-cousins
"Gaudy Night (Lord Peter Wimsey, #10)",https://www.goodreads.com/book/show/93575.Gaudy_Night
"Twelve Sharp (Stephanie Plum, #12)",https://www.goodreads.com/book/show/3507.Twelve_Sharp
"The Trespasser (Dublin Murder Squad, #6)",https://www.goodreads.com/book/show/34267285-the-trespasser
"The Black Echo (Harry Bosch Universe, #1)",https://www.goodreads.com/book/show/32508.The_Black_Echo
"After the Funeral (Hercule Poirot, #26)",https://www.goodreads.com/book/show/527744.After_the_Funeral
"A Morbid Taste for Bones (Chronicles of Brother Cadfael, #1)",https://www.goodreads.com/book/show/321545.A_Morbid_Taste_for_Bones
"Strong Poison (Lord Peter Wimsey, #5)",https://www.goodreads.com/book/show/246225.Strong_Poison
"Lean Mean Thirteen (Stephanie Plum, #13)",https://www.goodreads.com/book/show/40317.Lean_Mean_Thirteen
Firekeeper's Daughter,https://www.goodreads.com/book/show/52346471-firekeeper-s-daughter
"Finlay Donovan Is Killing It (Finlay Donovan, #1)",https://www.goodreads.com/book/show/53138099-finlay-donovan-is-killing-it
The Witch Elm,https://www.goodreads.com/book/show/39720991-the-witch-elm
"The Crossing Places (Ruth Galloway, #1)",https://www.goodreads.com/book/show/6688087-the-crossing-places
"The House of Silk (Horowitz's Holmes, #1)",https://www.goodreads.com/book/show/11093329-the-house-of-silk
"The Dead in Their Vaulted Arches (Flavia de Luce, #6)",https://www.goodreads.com/book/show/41017660-the-dead-in-their-vaulted-arches
Pretty Girls,https://www.goodreads.com/book/show/25574782-pretty-girls
"The Return of Sherlock Holmes (Sherlock Holmes, #6)",https://www.goodreads.com/book/show/194366.The_Return_of_Sherlock_Holmes
"A Great Reckoning (Chief Inspector Armand Gamache, #12)",https://www.goodreads.com/book/show/28220985-a-great-reckoning
"The Nature of the Beast (Chief Inspector Armand Gamache, #11)",https://www.goodreads.com/book/show/24586590-the-nature-of-the-beast
Everything I Never Told You,https://www.goodreads.com/book/show/18693763-everything-i-never-told-you
"Arsenic and Adobo (Tita Rosie's Kitchen Mystery, #1)",https://www.goodreads.com/book/show/54351235-arsenic-and-adobo
Paper Towns,https://www.goodreads.com/book/show/6442769-paper-towns
They Do It With Mirrors,https://www.goodreads.com/book/show/68930.They_Do_It_With_Mirrors
"Sad Cypress (Hercule Poirot, #19)",https://www.goodreads.com/book/show/433035.Sad_Cypress
"The Daughter of Time (Inspector Alan Grant, #5)",https://www.goodreads.com/book/show/77661.The_Daughter_of_Time
"Silent in the Grave (Lady Julia Grey, #1)",https://www.goodreads.com/book/show/267869.Silent_in_the_Grave
Nemesis,https://www.goodreads.com/book/show/31304.Nemesis
"Fearless Fourteen (Stephanie Plum, #14)",https://www.goodreads.com/book/show/2292384.Fearless_Fourteen
"The Mysterious Benedict Society (The Mysterious Benedict Society, #1)",https://www.goodreads.com/book/show/40605329-the-mysterious-benedict-society
One by One,https://www.goodreads.com/book/show/50892433-one-by-one
"Chocolate Chip Cookie Murder (Hannah Swensen, #1)",https://www.goodreads.com/book/show/36347162-chocolate-chip-cookie-murder
"Three Act Tragedy (Hercule Poirot, #10)",https://www.goodreads.com/book/show/140360.Three_Act_Tragedy
The Broken Girls,https://www.goodreads.com/book/show/35533431-the-broken-girls
"Finger Lickin' Fifteen (Stephanie Plum, #15)",https://www.goodreads.com/book/show/6048530-finger-lickin-fifteen
"Elephants Can Remember (Hercule Poirot, #33)",https://www.goodreads.com/book/show/148584.Elephants_Can_Remember
"Glass Houses (Chief Inspector Armand Gamache, #13)",https://www.goodreads.com/book/show/33602101-glass-houses
"As Good As Dead (A Good Girl's Guide to Murder, #3)",https://www.goodreads.com/book/show/56905097-as-good-as-dead
"The Curse of the Pharaohs (Amelia Peabody, #2)",https://www.goodreads.com/book/show/33622989-the-curse-of-the-pharaohs
The Searcher,https://www.goodreads.com/book/show/52661162-the-searcher
"The Thousand-Dollar Tan Line (Veronica Mars, #1)",https://www.goodreads.com/book/show/18209454-the-thousand-dollar-tan-line
"Dumb Witness (Hercule Poirot, #15)",https://www.goodreads.com/book/show/16344.Dumb_Witness
"C is for Corpse  (Kinsey Millhone, #3)",https://www.goodreads.com/book/show/89656.C_is_for_Corpse
"The Hidden Staircase (Nancy Drew Mystery Stories, #2)",https://www.goodreads.com/book/show/233637.The_Hidden_Staircase
"A Great Deliverance (Inspector Lynley, #1)",https://www.goodreads.com/book/show/31374.A_Great_Deliverance
Eight Perfect Murders,https://www.goodreads.com/book/show/52225186-eight-perfect-murders
"The Clocks (Hercule Poirot, #30)",https://www.goodreads.com/book/show/388018.The_Clocks
"Clouds of Witness (Lord Peter Wimsey, #2)",https://www.goodreads.com/book/show/192888.Clouds_of_Witness
"Origin (Robert Langdon, #5)",https://www.goodreads.com/book/show/32283133-origin
"Force of Nature (Aaron Falk, #2)",https://www.goodreads.com/book/show/34275222-force-of-nature
"The Diviners (The Diviners, #1)",https://www.goodreads.com/book/show/7728889-the-diviners
"Real Murders (Aurora Teagarden, #1)",https://www.goodreads.com/book/show/140091.Real_Murders
"A Monstrous Regiment of Women (Mary Russell and Sherlock Holmes, #2)",https://www.goodreads.com/book/show/104737.A_Monstrous_Regiment_of_Women
"The Hollow (Hercule Poirot, #23)",https://www.goodreads.com/book/show/16303.The_Hollow
"Glory in Death (In Death, #2)",https://www.goodreads.com/book/show/268601.Glory_in_Death
"Heat Wave (Nikki Heat, #1)",https://www.goodreads.com/book/show/6566722-heat-wave
All the Missing Girls,https://www.goodreads.com/book/show/23212667-all-the-missing-girls
Dr. Jekyll and Mr. Hyde,https://www.goodreads.com/book/show/51496.Dr_Jekyll_and_Mr_Hyde
The Woman in the Library,https://www.goodreads.com/book/show/56803179-the-woman-in-the-library
"As Chimney Sweepers Come to Dust (Flavia de Luce, #7)",https://www.goodreads.com/book/show/21874813-as-chimney-sweepers-come-to-dust
We Have Always Lived in the Castle,https://www.goodreads.com/book/show/89724.We_Have_Always_Lived_in_the_Castle
The Lost Man,https://www.goodreads.com/book/show/39863488-the-lost-man
"The Case of the Missing Marquess (Enola Holmes, #1)",https://www.goodreads.com/book/show/606928.The_Case_of_the_Missing_Marquess
"Fool Moon (The Dresden Files, #2)",https://www.goodreads.com/book/show/91477.Fool_Moon
"The Snowman (Harry Hole, #7)",https://www.goodreads.com/book/show/9572203-the-snowman
Defending Jacob,https://www.goodreads.com/book/show/11367726-defending-jacob
Final Girls,https://www.goodreads.com/book/show/32796253-final-girls
The Thirteen Problems,https://www.goodreads.com/book/show/31309.The_Thirteen_Problems
"The Valley of Fear (Sherlock Holmes, #7)",https://www.goodreads.com/book/show/736131.The_Valley_of_Fear
"One, Two, Buckle My Shoe (Hercule Poirot, #20)",https://www.goodreads.com/book/show/16312.One_Two_Buckle_My_Shoe
"D is for Deadbeat (Kinsey Millhone, #4)",https://www.goodreads.com/book/show/64857.D_is_for_Deadbeat
"Tears of the Giraffe (No. 1 Ladies' Detective Agency, #2)",https://www.goodreads.com/book/show/7039.Tears_of_the_Giraffe
"Kingdom of the Blind (Chief Inspector Armand Gamache, #14)",https://www.goodreads.com/book/show/38232379-kingdom-of-the-blind
The Book of Cold Cases,https://www.goodreads.com/book/show/58371432-the-book-of-cold-cases
The Last Time I Lied,https://www.goodreads.com/book/show/36626748-the-last-time-i-lied
The Devil and the Dark Water,https://www.goodreads.com/book/show/51854625-the-devil-and-the-dark-water
Lock Every Door,https://www.goodreads.com/book/show/41837243-lock-every-door
"Mr. Mercedes (Bill Hodges Trilogy, #1)",https://www.goodreads.com/book/show/18775247-mr-mercedes
"Kiss the Girls (Alex Cross, #2)",https://www.goodreads.com/book/show/13148.Kiss_the_Girls
"Smokin' Seventeen (Stephanie Plum, #17)",https://www.goodreads.com/book/show/11732634-smokin-seventeen
"Sizzling Sixteen (Stephanie Plum, #16)",https://www.goodreads.com/book/show/7023554-sizzling-sixteen
"Pardonable Lies (Maisie Dobbs, #3)",https://www.goodreads.com/book/show/7432.Pardonable_Lies
The Husband's Secret,https://www.goodreads.com/book/show/17802724-the-husband-s-secret
Joyland,https://www.goodreads.com/book/show/13596166-joyland
"Flaggermusmannen (Harry Hole, #1)",https://www.goodreads.com/book/show/1991039.Flaggermusmannen
