Title,URL
The Diary of a Young Girl,https://www.goodreads.com/book/show/48855.The_Diary_of_a_Young_Girl
Sapiens: A Brief History of Humankind,https://www.goodreads.com/book/show/23692271-sapiens
Educated,https://www.goodreads.com/book/show/35133922-educated
Quiet: The Power of Introverts in a World That Can't Stop Talking,https://www.goodreads.com/book/show/8520610-quiet
The Immortal Life of Henrietta Lacks,https://www.goodreads.com/book/show/6493208-the-immortal-life-of-henrietta-lacks
Freakonomics: A Rogue Economist Explores the Hidden Side of Everything,https://www.goodreads.com/book/show/1202.Freakonomics
Outliers: The Story of Success,https://www.goodreads.com/book/show/3228917-outliers
Becoming,https://www.goodreads.com/book/show/38746485-becoming
"The Devil in the White City: Murder, Magic, and Madness at the Fair That Changed America",https://www.goodreads.com/book/show/397483.The_Devil_in_the_White_City
A Short History of Nearly Everything,https://www.goodreads.com/book/show/21.A_Short_History_of_Nearly_Everything
We Should All Be Feminists,https://www.goodreads.com/book/show/22738563-we-should-all-be-feminists
Into the Wild,https://www.goodreads.com/book/show/1845.Into_the_Wild
"Night  (The Night Trilogy, #1)",https://www.goodreads.com/book/show/1617.Night
The Subtle Art of Not Giving a F*ck: A Counterintuitive Approach to Living a Good Life,https://www.goodreads.com/book/show/28257707-the-subtle-art-of-not-giving-a-f-ck
Between the World and Me,https://www.goodreads.com/book/show/25489625-between-the-world-and-me
Born a Crime: Stories From a South African Childhood,https://www.goodreads.com/book/show/29780253-born-a-crime
The Tipping Point: How Little Things Can Make a Big Difference,https://www.goodreads.com/book/show/2612.The_Tipping_Point
"Guns, Germs, and Steel: The Fates of Human Societies",https://www.goodreads.com/book/show/1842.Guns_Germs_and_Steel
Blink: The Power of Thinking Without Thinking,https://www.goodreads.com/book/show/40102.Blink
In Cold Blood,https://www.goodreads.com/book/show/168642.In_Cold_Blood
Bossypants,https://www.goodreads.com/book/show/9418327-bossypants
Man's Search for Meaning,https://www.goodreads.com/book/show/4069.Man_s_Search_for_Meaning
Atomic Habits: An Easy & Proven Way to Build Good Habits & Break Bad Ones,https://www.goodreads.com/book/show/40121378-atomic-habits
"Thinking, Fast and Slow",https://www.goodreads.com/book/show/11468377-thinking-fast-and-slow
When Breath Becomes Air,https://www.goodreads.com/book/show/25899336-when-breath-becomes-air
Stiff: The Curious Lives of Human Cadavers,https://www.goodreads.com/book/show/56769575-stiff
The Life-Changing Magic of Tidying Up: The Japanese Art of Decluttering and Organizing,https://www.goodreads.com/book/show/22318578-the-life-changing-magic-of-tidying-up
A Brief History of Time,https://www.goodreads.com/book/show/3869.A_Brief_History_of_Time
Into Thin Air: A Personal Account of the Mount Everest Disaster,https://www.goodreads.com/book/show/1898.Into_Thin_Air
The Glass Castle,https://www.goodreads.com/book/show/7445.The_Glass_Castle
On Writing: A Memoir of the Craft,https://www.goodreads.com/book/show/10569.On_Writing
"Unbroken: A World War II Story of Survival, Resilience and Redemption",https://www.goodreads.com/book/show/8664353-unbroken
Wild: From Lost to Found on the Pacific Crest Trail,https://www.goodreads.com/book/show/12262741-wild
The Power of Habit: Why We Do What We Do in Life and Business,https://www.goodreads.com/book/show/12609433-the-power-of-habit
I Am Malala: The Story of the Girl Who Stood Up for Education and Was Shot by the Taliban,https://www.goodreads.com/book/show/17851885-i-am-malala
I'll Be Gone in the Dark: One Woman's Obsessive Search for the Golden State Killer,https://www.goodreads.com/book/show/35068432-i-ll-be-gone-in-the-dark
A Walk in the Woods: Rediscovering America on the Appalachian Trail,https://www.goodreads.com/book/show/9791.A_Walk_in_the_Woods
Yes Please,https://www.goodreads.com/book/show/20910157-yes-please
The Man Who Mistook His Wife for a Hat and Other Clinical Tales,https://www.goodreads.com/book/show/63697.The_Man_Who_Mistook_His_Wife_for_a_Hat_and_Other_Clinical_Tales
Invisible Women: Data Bias in a World Designed for Men,https://www.goodreads.com/book/show/41104077-invisible-women
"Eat, Pray, Love",https://www.goodreads.com/book/show/19501.Eat_Pray_Love
The Art of War,https://www.goodreads.com/book/show/10534.The_Art_of_War
Hillbilly Elegy: A Memoir of a Family and Culture in Crisis,https://www.goodreads.com/book/show/27161156-hillbilly-elegy
Homo Deus: A History of Tomorrow,https://www.goodreads.com/book/show/31138556-homo-deus
How to Win Friends and Influence People,https://www.goodreads.com/book/show/4865.How_to_Win_Friends_and_Influence_People
The Omnivore's Dilemma: A Natural History of Four Meals,https://www.goodreads.com/book/show/3109.The_Omnivore_s_Dilemma
"What If? Serious Scientific Answers to Absurd Hypothetical Questions (What If?, #1)",https://www.goodreads.com/book/show/21413662-what-if-serious-scientific-answers-to-absurd-hypothetical-questions
The God Delusion,https://www.goodreads.com/book/show/14743.The_God_Delusion
Astrophysics for People in a Hurry,https://www.goodreads.com/book/show/32191710-astrophysics-for-people-in-a-hurry
Is Everyone Hanging Out Without Me? (And Other Concerns),https://www.goodreads.com/book/show/10335308-is-everyone-hanging-out-without-me
Killers of the Flower Moon: The Osage Murders and the Birth of the FBI,https://www.goodreads.com/book/show/29496076-killers-of-the-flower-moon
Bad Blood: Secrets and Lies in a Silicon Valley Startup,https://www.goodreads.com/book/show/37976541-bad-blood
I'm Glad My Mom Died,https://www.goodreads.com/book/show/59364173-i-m-glad-my-mom-died
Bad Feminist,https://www.goodreads.com/book/show/18813642-bad-feminist
Talking to Strangers: What We Should Know About the People We Don’t Know,https://www.goodreads.com/book/show/43848929-talking-to-strangers
Tuesdays with Morrie,https://www.goodreads.com/book/show/6900.Tuesdays_with_Morrie
White Fragility: Why It’s So Hard for White People to Talk About Racism,https://www.goodreads.com/book/show/43708708-white-fragility
Why We Sleep: Unlocking the Power of Sleep and Dreams,https://www.goodreads.com/book/show/34466963-why-we-sleep
Under the Banner of Heaven: A Story of Violent Faith,https://www.goodreads.com/book/show/10847.Under_the_Banner_of_Heaven
Just Mercy: A Story of Justice and Redemption,https://www.goodreads.com/book/show/20342617-just-mercy
Why I'm No Longer Talking to White People About Race,https://www.goodreads.com/book/show/33606119-why-i-m-no-longer-talking-to-white-people-about-race
The New Jim Crow: Mass Incarceration in the Age of Colorblindness,https://www.goodreads.com/book/show/6792458-the-new-jim-crow
"I Know Why the Caged Bird Sings (Maya Angelou's Autobiography, #1)",https://www.goodreads.com/book/show/13214.I_Know_Why_the_Caged_Bird_Sings
Being Mortal: Medicine and What Matters in the End,https://www.goodreads.com/book/show/20696006-being-mortal
The Radium Girls:The Dark Story of America’s Shining Women (Harrowing Historical Nonfiction Bestseller About a Courageous Fight for Justice),https://www.goodreads.com/book/show/31409135-the-radium-girls
The Psychopath Test: A Journey Through the Madness Industry,https://www.goodreads.com/book/show/12391521-the-psychopath-test
Caste: The Origins of Our Discontents,https://www.goodreads.com/book/show/51152447-caste
So You Want to Talk About Race,https://www.goodreads.com/book/show/35099718-so-you-want-to-talk-about-race
Me Talk Pretty One Day,https://www.goodreads.com/book/show/4137.Me_Talk_Pretty_One_Day
A Room of One's Own,https://www.goodreads.com/book/show/18521.A_Room_of_One_s_Own
The Library Book,https://www.goodreads.com/book/show/39507318-the-library-book
Factfulness: Ten Reasons We're Wrong About the World – and Why Things Are Better Than You Think,https://www.goodreads.com/book/show/34890015-factfulness
The 7 Habits of Highly Effective People: Powerful Lessons in Personal Change,https://www.goodreads.com/book/show/36072.The_7_Habits_of_Highly_Effective_People
How to Be an Antiracist,https://www.goodreads.com/book/show/40265832-how-to-be-an-antiracist
Maybe You Should Talk to Someone,https://www.goodreads.com/book/show/37570546-maybe-you-should-talk-to-someone
Modern Romance,https://www.goodreads.com/book/show/23453112-modern-romance
Kitchen Confidential: Adventures in the Culinary Underbelly,https://www.goodreads.com/book/show/33313.Kitchen_Confidential
Know My Name,https://www.goodreads.com/book/show/50196744-know-my-name
A People's History of the United States,https://www.goodreads.com/book/show/2767.A_People_s_History_of_the_United_States
Smoke Gets in Your Eyes & Other Lessons from the Crematory,https://www.goodreads.com/book/show/25189315-smoke-gets-in-your-eyes-other-lessons-from-the-crematory
Nickel and Dimed: On (Not) Getting by in America,https://www.goodreads.com/book/show/1869.Nickel_and_Dimed
Fast Food Nation: The Dark Side of the All-American Meal,https://www.goodreads.com/book/show/1097.Fast_Food_Nation
Crying in H Mart,https://www.goodreads.com/book/show/54814676-crying-in-h-mart
"In the Garden of Beasts: Love, Terror, and an American Family in Hitler's Berlin",https://www.goodreads.com/book/show/9938498-in-the-garden-of-beasts
Three Cups of Tea: One Man's Mission to Promote Peace ... One School at a Time,https://www.goodreads.com/book/show/49436.Three_Cups_of_Tea
This is Going to Hurt: Secret Diaries of a Junior Doctor,https://www.goodreads.com/book/show/35510008-this-is-going-to-hurt
The Prince,https://www.goodreads.com/book/show/28862.The_Prince
Nothing to Envy: Ordinary Lives in North Korea,https://www.goodreads.com/book/show/40604846-nothing-to-envy
21 Lessons for the 21st Century,https://www.goodreads.com/book/show/38820046-21-lessons-for-the-21st-century
The Last Lecture,https://www.goodreads.com/book/show/40611510-the-last-lecture
Men Explain Things to Me,https://www.goodreads.com/book/show/18528190-men-explain-things-to-me
The Emperor of All Maladies: A Biography of Cancer,https://www.goodreads.com/book/show/7170627-the-emperor-of-all-maladies
"The Body Keeps the Score: Brain, Mind, and Body in the Healing of Trauma",https://www.goodreads.com/book/show/18693771-the-body-keeps-the-score
The Boys in the Boat: Nine Americans and Their Epic Quest for Gold at the 1936 Berlin Olympics,https://www.goodreads.com/book/show/16158542-the-boys-in-the-boat
"Daring Greatly: How the Courage to Be Vulnerable Transforms the Way We Live, Love, Parent, and Lead",https://www.goodreads.com/book/show/13588356-daring-greatly
"Daring Greatly: How the Courage to Be Vulnerable Transforms the Way We Live, Love, Parent, and Lead",https://www.goodreads.com/book/show/13588356-daring-greatly
The Selfish Gene,https://www.goodreads.com/book/show/61535.The_Selfish_Gene
The Year of Magical Thinking,https://www.goodreads.com/book/show/7815.The_Year_of_Magical_Thinking
Evicted: Poverty and Profit in the American City,https://www.goodreads.com/book/show/25852784-evicted
Steve Jobs,https://www.goodreads.com/book/show/11084145-steve-jobs
"Angela's Ashes (Frank McCourt, #1)",https://www.goodreads.com/book/show/252577.Angela_s_Ashes
Dead Wake: The Last Crossing of the Lusitania,https://www.goodreads.com/book/show/22551730-dead-wake
A Promised Land,https://www.goodreads.com/book/show/55361205-a-promised-land
Hunger: A Memoir of (My) Body,https://www.goodreads.com/book/show/26074156-hunger
Columbine,https://www.goodreads.com/book/show/5632446-columbine
"The Professor and the Madman: A Tale of Murder, Insanity and the Making of the Oxford English Dictionary",https://www.goodreads.com/book/show/25019.The_Professor_and_the_Madman
"David and Goliath: Underdogs, Misfits, and the Art of Battling Giants",https://www.goodreads.com/book/show/15751404-david-and-goliath
"Eats, Shoots & Leaves: The Zero Tolerance Approach to Punctuation",https://www.goodreads.com/book/show/8600.Eats_Shoots_Leaves
The Anthropocene Reviewed,https://www.goodreads.com/book/show/55145261-the-anthropocene-reviewed
Brain on Fire: My Month of Madness,https://www.goodreads.com/book/show/63221207-brain-on-fire
Midnight in the Garden of Good and Evil,https://www.goodreads.com/book/show/386187.Midnight_in_the_Garden_of_Good_and_Evil
The Sixth Extinction: An Unnatural History,https://www.goodreads.com/book/show/17910054-the-sixth-extinction
So You've Been Publicly Shamed,https://www.goodreads.com/book/show/22571552-so-you-ve-been-publicly-shamed
The Warmth of Other Suns: the Epic Story of America's Great Migration,https://www.goodreads.com/book/show/8171378-the-warmth-of-other-suns
The Communist Manifesto,https://www.goodreads.com/book/show/30474.The_Communist_Manifesto
Big Magic: Creative Living Beyond Fear,https://www.goodreads.com/book/show/24453082-big-magic
Furiously Happy: A Funny Book About Horrible Things,https://www.goodreads.com/book/show/23848559-furiously-happy
"Behind the Beautiful Forevers: Life, Death, and Hope in a Mumbai Undercity",https://www.goodreads.com/book/show/11869272-behind-the-beautiful-forevers
"Catch and Kill: Lies, Spies, and a Conspiracy to Protect Predators",https://www.goodreads.com/book/show/51022071-catch-and-kill
The Autobiography of Malcolm X,https://www.goodreads.com/book/show/92057.The_Autobiography_of_Malcolm_X
"The Happiness Project: Or Why I Spent a Year Trying to Sing in the Morning, Clean My Closets, Fight Right, Read Aristotle, and Generally Have More Fun",https://www.goodreads.com/book/show/6398634-the-happiness-project
Braiding Sweetgrass,https://www.goodreads.com/book/show/17465709-braiding-sweetgrass
Hidden Figures,https://www.goodreads.com/book/show/25953369-hidden-figures
"Born to Run: A Hidden Tribe, Superathletes, and the Greatest Race the World Has Never Seen",https://www.goodreads.com/book/show/6289283-born-to-run
"Dear Ijeawele, or a Feminist Manifesto in Fifteen Suggestions",https://www.goodreads.com/book/show/33585392-dear-ijeawele-or-a-feminist-manifesto-in-fifteen-suggestions
In Defense of Food: An Eater's Manifesto,https://www.goodreads.com/book/show/315425.In_Defense_of_Food
Hood Feminism: Notes from the Women That a Movement Forgot,https://www.goodreads.com/book/show/36687229-hood-feminism
"Lean In: Women, Work, and the Will to Lead",https://www.goodreads.com/book/show/16071764-lean-in
Eating Animals,https://www.goodreads.com/book/show/6604712-eating-animals
Say Nothing: A True Story of Murder and Memory in Northern Ireland,https://www.goodreads.com/book/show/40163119-say-nothing
At Home: A Short History of Private Life,https://www.goodreads.com/book/show/7507825-at-home
The Body: A Guide for Occupants,https://www.goodreads.com/book/show/43582376-the-body
"The Hidden Life of Trees: What They Feel, How They Communicate: Discoveries from a Secret World",https://www.goodreads.com/book/show/28256439-the-hidden-life-of-trees
Meditations,https://www.goodreads.com/book/show/30659.Meditations
Bird by Bird: Some Instructions on Writing and Life,https://www.goodreads.com/book/show/12543.Bird_by_Bird
Orange Is the New Black,https://www.goodreads.com/book/show/6314763-orange-is-the-new-black
Let's Pretend This Never Happened: A Mostly True Memoir,https://www.goodreads.com/book/show/12868761-let-s-pretend-this-never-happened
Untamed,https://www.goodreads.com/book/show/52129515-untamed
What I Talk About When I Talk About Running,https://www.goodreads.com/book/show/2195464.What_I_Talk_About_When_I_Talk_About_Running
The Gifts of Imperfection,https://www.goodreads.com/book/show/7015403-the-gifts-of-imperfection
Predictably Irrational: The Hidden Forces That Shape Our Decisions,https://www.goodreads.com/book/show/1713426.Predictably_Irrational
Helter Skelter: The True Story of the Manson Murders,https://www.goodreads.com/book/show/105992.Helter_Skelter
The Lost City of Z: A Tale of Deadly Obsession in the Amazon,https://www.goodreads.com/book/show/3398625-the-lost-city-of-z
"""Surely You're Joking, Mr. Feynman!"": Adventures of a Curious Character",https://www.goodreads.com/book/show/35167685-surely-you-re-joking-mr-feynman
Just Kids,https://www.goodreads.com/book/show/341879.Just_Kids
Why Not Me?,https://www.goodreads.com/book/show/30268522-why-not-me
"A Child Called ""It"" (Dave Pelzer, #1)",https://www.goodreads.com/book/show/60748.A_Child_Called_It_
In the Dream House,https://www.goodreads.com/book/show/43317482-in-the-dream-house
The 5 Love Languages: The Secret to Love that Lasts,https://www.goodreads.com/book/show/23878688-the-5-love-languages
Deep Work: Rules for Focused Success in a Distracted World,https://www.goodreads.com/book/show/25744928-deep-work
The Fire Next Time,https://www.goodreads.com/book/show/464260.The_Fire_Next_Time
Cosmos,https://www.goodreads.com/book/show/55030.Cosmos
The Five: The Untold Lives of the Women Killed by Jack the Ripper,https://www.goodreads.com/book/show/37570548-the-five
How to Be a Woman,https://www.goodreads.com/book/show/10600242-how-to-be-a-woman
"Rich Dad, Poor Dad",https://www.goodreads.com/book/show/69571.Rich_Dad_Poor_Dad
Moonwalking with Einstein: The Art and Science of Remembering Everything,https://www.goodreads.com/book/show/6346975-moonwalking-with-einstein
Packing for Mars: The Curious Science of Life in the Void,https://www.goodreads.com/book/show/9542311-packing-for-mars
Cultish: The Language of Fanaticism,https://www.goodreads.com/book/show/55338982-cultish
Hidden Valley Road: Inside the Mind of an American Family,https://www.goodreads.com/book/show/50088631-hidden-valley-road
Bonk: The Curious Coupling of Science and Sex,https://www.goodreads.com/book/show/5981308-bonk
Mere Christianity,https://www.goodreads.com/book/show/40792344-mere-christianity
"Hyperbole and a Half: Unfortunate Situations, Flawed Coping Mechanisms, Mayhem, and Other Things That Happened",https://www.goodreads.com/book/show/17571564-hyperbole-and-a-half
Prisoners of Geography: Ten Maps That Tell You Everything You Need to Know About Global Politics,https://www.goodreads.com/book/show/25135194-prisoners-of-geography
Reading Lolita in Tehran: A Memoir in Books,https://www.goodreads.com/book/show/7603.Reading_Lolita_in_Tehran
Empire of Pain: The Secret History of the Sackler Dynasty,https://www.goodreads.com/book/show/43868109-empire-of-pain
Bury My Heart at Wounded Knee: An Indian History of the American West,https://www.goodreads.com/book/show/76401.Bury_My_Heart_at_Wounded_Knee
The Big Short: Inside the Doomsday Machine,https://www.goodreads.com/book/show/26889576-the-big-short
The Hot Zone: The Terrifying True Story of the Origins of the Ebola Virus,https://www.goodreads.com/book/show/16213.The_Hot_Zone
The Princess Diarist,https://www.goodreads.com/book/show/26025989-the-princess-diarist
Alexander Hamilton,https://www.goodreads.com/book/show/16130.Alexander_Hamilton
The Origin of Species,https://www.goodreads.com/book/show/22463.The_Origin_of_Species
Collapse: How Societies Choose to Fail or Succeed,https://www.goodreads.com/book/show/475.Collapse
Reasons to Stay Alive,https://www.goodreads.com/book/show/25733573-reasons-to-stay-alive
The Four Agreements,https://www.goodreads.com/book/show/6596.The_Four_Agreements
1776,https://www.goodreads.com/book/show/1067.1776
God Is Not Great: How Religion Poisons Everything,https://www.goodreads.com/book/show/43369.God_Is_Not_Great
Notes from a Small Island,https://www.goodreads.com/book/show/28.Notes_from_a_Small_Island
12 Rules for Life: An Antidote to Chaos,https://www.goodreads.com/book/show/30257963-12-rules-for-life
The Elements of Style,https://www.goodreads.com/book/show/33514.The_Elements_of_Style
The Black Swan: The Impact of the Highly Improbable,https://www.goodreads.com/book/show/242472.The_Black_Swan
In a Sunburned Country,https://www.goodreads.com/book/show/24.In_a_Sunburned_Country
Walden,https://www.goodreads.com/book/show/16902.Walden
The Hiding Place: The Triumphant True Story of Corrie Ten Boom,https://www.goodreads.com/book/show/561909.The_Hiding_Place
Marley and Me: Life and Love With the World's Worst Dog,https://www.goodreads.com/book/show/12691.Marley_and_Me
Trick Mirror: Reflections on Self-Delusion,https://www.goodreads.com/book/show/43126457-trick-mirror
Talking as Fast as I Can: From Gilmore Girls to Gilmore Girls (and Everything in Between),https://www.goodreads.com/book/show/40411206-talking-as-fast-as-i-can
"Animal, Vegetable, Miracle: A Year of Food Life",https://www.goodreads.com/book/show/40725379-animal-vegetable-miracle
In the Heart of the Sea: The Tragedy of the Whaleship Essex,https://www.goodreads.com/book/show/17780.In_the_Heart_of_the_Sea
The Little Book of Hygge: The Danish Way to Live Well,https://www.goodreads.com/book/show/30045683-the-little-book-of-hygge
From Here to Eternity: Traveling the World to Find the Good Death,https://www.goodreads.com/book/show/38212121-from-here-to-eternity
"84, Charing Cross Road",https://www.goodreads.com/book/show/368916.84_Charing_Cross_Road
Salt: A World History,https://www.goodreads.com/book/show/2715.Salt
On Tyranny: Twenty Lessons from the Twentieth Century,https://www.goodreads.com/book/show/33917107-on-tyranny
The Power of Now: A Guide to Spiritual Enlightenment,https://www.goodreads.com/book/show/6708.The_Power_of_Now
Gulp: Adventures on the Alimentary Canal,https://www.goodreads.com/book/show/18377999-gulp
As You Wish: Inconceivable Tales from the Making of The Princess Bride,https://www.goodreads.com/book/show/21412202-as-you-wish
Will My Cat Eat My Eyeballs? And other Questions about Dead Bodies,https://www.goodreads.com/book/show/52672113-will-my-cat-eat-my-eyeballs-and-other-questions-about-dead-bodies
Endurance: Shackleton's Incredible Voyage,https://www.goodreads.com/book/show/139069.Endurance
1491: New Revelations of the Americas Before Columbus,https://www.goodreads.com/book/show/39020.1491
Running with Scissors,https://www.goodreads.com/book/show/242006.Running_with_Scissors
A Long Way Gone: Memoirs of a Boy Soldier,https://www.goodreads.com/book/show/43015.A_Long_Way_Gone
Stamped from the Beginning: The Definitive History of Racist Ideas in America,https://www.goodreads.com/book/show/25898216-stamped-from-the-beginning
"The Ghost Map: The Story of London's Most Terrifying Epidemic—and How It Changed Science, Cities, and the Modern World",https://www.goodreads.com/book/show/36086.The_Ghost_Map
"The Disappearing Spoon: And Other True Tales of Madness, Love, and the History of the World from the Periodic Table of the Elements",https://www.goodreads.com/book/show/7247854-the-disappearing-spoon
What the Dog Saw and Other Adventures,https://www.goodreads.com/book/show/6516450-what-the-dog-saw-and-other-adventures
"The Splendid and the Vile: A Saga of Churchill, Family, and Defiance During the Blitz",https://www.goodreads.com/book/show/51187948-the-splendid-and-the-vile
Tiny Beautiful Things: Advice from Dear Sugar,https://www.goodreads.com/book/show/63193458-tiny-beautiful-things
Dreams from My Father: A Story of Race and Inheritance,https://www.goodreads.com/book/show/88061.Dreams_from_My_Father
H is for Hawk,https://www.goodreads.com/book/show/18803640-h-is-for-hawk
Lab Girl,https://www.goodreads.com/book/show/25733983-lab-girl
"Girl, Interrupted",https://www.goodreads.com/book/show/68783.Girl_Interrupted
Who Moved My Cheese?,https://www.goodreads.com/book/show/4894.Who_Moved_My_Cheese_
Team of Rivals: The Political Genius of Abraham Lincoln,https://www.goodreads.com/book/show/2199.Team_of_Rivals
Midnight in Chernobyl: The Untold Story of the World's Greatest Nuclear Disaster,https://www.goodreads.com/book/show/40538681-midnight-in-chernobyl
Mindset: The New Psychology of Success,https://www.goodreads.com/book/show/40745.Mindset
"Persepolis: The Story of a Childhood (Persepolis, #1)",https://www.goodreads.com/book/show/9516.Persepolis
Voices from Chernobyl: The Oral History of a Nuclear Disaster,https://www.goodreads.com/book/show/357486.Voices_from_Chernobyl
Essentialism: The Disciplined Pursuit of Less,https://www.goodreads.com/book/show/18077875-essentialism
The Demon-Haunted World: Science as a Candle in the Dark,https://www.goodreads.com/book/show/17349.The_Demon_Haunted_World
Grit: The Power of Passion and Perseverance,https://www.goodreads.com/book/show/27213329-grit
Wishful Drinking,https://www.goodreads.com/book/show/4961048-wishful-drinking
The 4-Hour Workweek,https://www.goodreads.com/book/show/368593.The_4_Hour_Workweek
SPQR: A History of Ancient Rome,https://www.goodreads.com/book/show/28789711-spqr
The Mother Tongue: English and How It Got That Way,https://www.goodreads.com/book/show/29.The_Mother_Tongue
The Gene: An Intimate History,https://www.goodreads.com/book/show/27276428-the-gene
Digital Minimalism: Choosing a Focused Life in a Noisy World,https://www.goodreads.com/book/show/40672036-digital-minimalism
"Elon Musk: Tesla, SpaceX, and the Quest for a Fantastic Future",https://www.goodreads.com/book/show/25541028-elon-musk
The Second Sex,https://www.goodreads.com/book/show/457264.The_Second_Sex
The Righteous Mind: Why Good People Are Divided by Politics and Religion,https://www.goodreads.com/book/show/11324722-the-righteous-mind
You're Never Weird on the Internet (Almost),https://www.goodreads.com/book/show/23705512-you-re-never-weird-on-the-internet
Missoula: Rape and the Justice System in a College Town,https://www.goodreads.com/book/show/24911006-missoula
The Complete Persepolis,https://www.goodreads.com/book/show/991197.The_Complete_Persepolis
The Shock Doctrine: The Rise of Disaster Capitalism,https://www.goodreads.com/book/show/1237300.The_Shock_Doctrine
Fun Home: A Family Tragicomic,https://www.goodreads.com/book/show/26135825-fun-home
Shrill: Notes from a Loud Woman,https://www.goodreads.com/book/show/29340182-shrill
The Stranger Beside Me: Ted Bundy: The Shocking Inside Story,https://www.goodreads.com/book/show/15654.The_Stranger_Beside_Me
